half,time-minutes,time-seconds,details,player1-id,player2-id,player1-linkable,player2-linkable,player3-linkable,player-first-name-1,player-first-name-2,player-last-name-1,player-last-name-2,player-team-alias-1,player-team-alias-2,home-score,visitor-score,visitor-fouls,home-fouls,player-fouls,fastbreak,in-paint,second-chance,off-turnover,player-score,points-type,detail-id,detail-desc,event-id,event-desc,distance,x-coord,y-coord,team-id-1,team-id-2,team-id-3
2,19,26,Aaron White misses a layup shot.,110455,,true,false,false,Aaron,,White,,Iowa,,52,45,0,0,1,,,,,8,2,40,Layup Shot,4,Field Goal Missed,0,0,0,74,74,
2,19,26,Pat Connaughton with a defensive rebound.,109491,,true,false,false,Pat,,Connaughton,,ND,,52,45,0,0,2,,,,,5,,,,6,Defensive Rebound,,,,46,46,
2,19,19,Jerian Grant with a lost ball turnover: Lost Ball,97480,,true,false,false,Jerian,,Grant,,ND,,52,45,0,0,1,,,,,9,,2,Lost Ball,7,Turnover,,,,46,46,
2,19,14,Mike Gesell with a lost ball turnover: Lost Ball,116763,,true,false,false,Mike,,Gesell,,Iowa,,52,45,0,0,1,,,,,5,,2,Lost Ball,7,Turnover,,,,74,74,
2,19,12,Eric Atkins makes a layup shot. Pat Connaughton with the assist.,97478,109491,true,true,false,Eric,Pat,Atkins,Connaughton,ND,ND,52,47,0,0,2,,,,,5,2,40,Layup Shot,3,Field Goal Made,0,0,0,46,46,
2,18,45,Personal foul committed by Pat Connaughton.,109491,,true,false,false,Pat,,Connaughton,,ND,,52,47,1,0,3,,,,,5,,1,Personal,8,Foul,,,,46,46,
2,18,33,Mike Gesell makes a 3-point jump shot from 23 feet out. Adam Woodbury with the assist.,116763,116765,true,true,false,Mike,Adam,Gesell,Woodbury,Iowa,Iowa,55,47,1,0,1,,,,,8,3,45,Jump Shot,3,Field Goal Made,23,-21.7,8.6,74,74,
2,17,57,Eric Atkins makes a 3-point jump shot from 22 feet out. Pat Connaughton with the assist.,97478,109491,true,true,false,Eric,Pat,Atkins,Connaughton,ND,ND,55,50,1,0,2,,,,,8,3,45,Jump Shot,3,Field Goal Made,22,20,10.1,46,46,
2,17,44,Personal foul committed by Garrick Sherman.,88941,,true,false,false,Garrick,,Sherman,,ND,,55,50,2,0,3,,,,,20,,1,Personal,8,Foul,,,,46,46,
2,17,44,Adam Woodbury misses a jump shot from 16 feet out.,116765,,true,false,false,Adam,,Woodbury,,Iowa,,55,50,2,0,1,,,,,4,2,45,Jump Shot,4,Field Goal Missed,16,-12.7,9.4,74,74,
2,17,44,Garrick Sherman with a defensive rebound.,88941,,true,false,false,Garrick,,Sherman,,ND,,55,50,2,0,3,,,,,20,,,,6,Defensive Rebound,,,,46,46,
2,17,40,Melsahn Basabe misses a jump shot from 8 feet out.,97658,,true,false,false,Melsahn,,Basabe,,Iowa,,55,50,2,0,0,,,,,6,2,45,Jump Shot,4,Field Goal Missed,8,7,4,74,74,
2,17,40,Jerian Grant with a defensive rebound.,97480,,true,false,false,Jerian,,Grant,,ND,,55,50,2,0,1,,,,,9,,,,6,Defensive Rebound,,,,46,46,
2,17,30,Jerian Grant misses a jump shot from 14 feet out.,97480,,true,false,false,Jerian,,Grant,,ND,,55,50,2,0,1,,,,,9,2,45,Jump Shot,4,Field Goal Missed,14,1,14,46,46,
2,17,30,Roy Devyn Marble with a defensive rebound.,97656,,true,false,false,Roy Devyn,,Marble,,Iowa,,55,50,2,0,0,,,,,4,,,,6,Defensive Rebound,,,,74,74,
2,17,10,Pat Connaughton misses a 3-point jump shot from 23 feet out.,109491,,true,false,false,Pat,,Connaughton,,ND,,55,50,2,0,3,,,,,5,3,45,Jump Shot,4,Field Goal Missed,23,17.6,14.9,46,46,
2,17,10,Jerian Grant with an offensive rebound.,97480,,true,false,false,Jerian,,Grant,,ND,,55,50,2,0,1,,,,,9,,,,5,Offensive Rebound,,,,46,46,
2,16,54,Garrick Sherman makes a layup shot. Jerian Grant with the assist.,88941,97480,true,true,false,Garrick,Jerian,Sherman,Grant,ND,ND,55,52,2,0,3,,,,,22,2,40,Layup Shot,3,Field Goal Made,0,0,0,46,46,
2,16,54,Shooting foul committed by Mike Gesell.,116763,,true,false,false,Mike,,Gesell,,Iowa,,55,52,2,1,2,,,,,8,,2,Shooting,8,Foul,,,,74,74,
2,16,54,Garrick Sherman makes free throw 1 of 1.,88941,,true,false,false,Garrick,,Sherman,,ND,,55,53,2,1,3,,,,,23,1,10,Free Throw 1 of 1,1,Free Throw Made,,,,46,46,
2,16,21,Zach McCabe misses a hook shot from 9 feet out.,97657,,true,false,false,Zach,,McCabe,,Iowa,,55,53,2,1,2,,,,,7,2,55,Hook Shot,4,Field Goal Missed,9,-.6,8.9,74,74,
2,16,21,Jerian Grant with a defensive rebound.,97480,,true,false,false,Jerian,,Grant,,ND,,55,53,2,1,1,,,,,9,,,,6,Defensive Rebound,,,,46,46,
2,16,13,Shooting foul committed by Gabriel Olaseni.,110453,,true,false,false,Gabriel,,Olaseni,,Iowa,,55,53,2,2,2,,,,,9,,2,Shooting,8,Foul,,,,74,74,
2,16,13,Pat Connaughton makes free throw 1 of 2.,109491,,true,false,false,Pat,,Connaughton,,ND,,55,54,2,2,3,,,,,6,1,11,Free Throw 1 of 2,1,Free Throw Made,,,,46,46,
2,16,13,Pat Connaughton makes free throw 2 of 2.,109491,,true,false,false,Pat,,Connaughton,,ND,,55,55,2,2,3,,,,,7,1,12,Free Throw 2 of 2,1,Free Throw Made,,,,46,46,
2,15,52,Roy Devyn Marble misses a layup shot.,97656,,true,false,false,Roy Devyn,,Marble,,Iowa,,55,55,2,2,0,,,,,4,2,40,Layup Shot,4,Field Goal Missed,0,0,0,74,74,
2,15,52,Garrick Sherman with a defensive rebound.,88941,,true,false,false,Garrick,,Sherman,,ND,,55,55,2,2,3,,,,,23,,,,6,Defensive Rebound,,,,46,46,
2,15,45,Eric Atkins makes a layup shot.,97478,,true,false,false,Eric,,Atkins,,ND,,55,57,2,2,2,,,,,10,2,40,Layup Shot,3,Field Goal Made,0,0,0,46,46,
2,15,45,Shooting foul committed by Gabriel Olaseni.,110453,,true,false,false,Gabriel,,Olaseni,,Iowa,,55,57,2,3,3,,,,,9,,2,Shooting,8,Foul,,,,74,74,
2,15,45,Official TV timeout.,,,false,false,false,,,,,,,55,57,2,3,0,,,,,0,,3,Official TV,11,Timeout,,,,74,74,
2,15,45,Eric Atkins misses free throw 1 of 1.,97478,,true,false,false,Eric,,Atkins,,ND,,55,57,2,3,2,,,,,10,1,10,Free Throw 1 of 1,2,Free Throw Missed,,,,46,46,
2,15,45,Aaron White with a defensive rebound.,110455,,true,false,false,Aaron,,White,,Iowa,,55,57,2,3,1,,,,,8,,,,6,Defensive Rebound,,,,74,74,
2,15,36,Roy Devyn Marble makes a 3-point jump shot from 23 feet out. Aaron White with the assist.,97656,110455,true,true,false,Roy Devyn,Aaron,Marble,White,Iowa,Iowa,58,57,2,3,0,,,,,7,3,45,Jump Shot,3,Field Goal Made,23,21.9,7.4,74,74,
2,15,13,Pat Connaughton makes a 3-point jump shot from 23 feet out. Jerian Grant with the assist.,109491,97480,true,true,false,Pat,Jerian,Connaughton,Grant,ND,ND,58,60,2,3,3,,,,,10,3,45,Jump Shot,3,Field Goal Made,23,-20.2,11.5,46,46,
2,14,53,Roy Devyn Marble makes a layup shot.,97656,,true,false,false,Roy Devyn,,Marble,,Iowa,,60,60,2,3,0,,,,,9,2,40,Layup Shot,3,Field Goal Made,0,0,0,74,74,
2,14,23,Garrick Sherman misses a hook shot from 8 feet out.,88941,,true,false,false,Garrick,,Sherman,,ND,,60,60,2,3,3,,,,,23,2,55,Hook Shot,4,Field Goal Missed,8,.3,7.6,46,46,
2,14,23,Jarrod Uthoff with a defensive rebound.,110237,,true,false,false,Jarrod,,Uthoff,,Iowa,,60,60,2,3,1,,,,,6,,,,6,Defensive Rebound,,,,74,74,
2,14,11,Roy Devyn Marble makes a layup shot.,97656,,true,false,false,Roy Devyn,,Marble,,Iowa,,62,60,2,3,0,,,,,11,2,40,Layup Shot,3,Field Goal Made,0,0,0,74,74,
2,13,33,Jerian Grant misses a 3-point jump shot from 25 feet out.,97480,,true,false,false,Jerian,,Grant,,ND,,62,60,2,3,1,,,,,9,3,45,Jump Shot,4,Field Goal Missed,25,-12.5,21.8,46,46,
2,13,33,Zach McCabe with a defensive rebound.,97657,,true,false,false,Zach,,McCabe,,Iowa,,62,60,2,3,2,,,,,7,,,,6,Defensive Rebound,,,,74,74,
2,13,22,Shooting foul committed by Eric Atkins.,97478,,true,false,false,Eric,,Atkins,,ND,,62,60,3,3,3,,,,,10,,2,Shooting,8,Foul,,,,46,46,
2,13,22,Roy Devyn Marble misses free throw 1 of 2.,97656,,true,false,false,Roy Devyn,,Marble,,Iowa,,62,60,3,3,0,,,,,11,1,11,Free Throw 1 of 2,2,Free Throw Missed,,,,74,74,
2,13,22,Iowa with an offensive rebound.,,,false,false,false,,,,,,,62,60,3,3,0,,,,,0,,,,5,Offensive Rebound,,,,74,74,
2,13,22,Roy Devyn Marble makes free throw 2 of 2.,97656,,true,false,false,Roy Devyn,,Marble,,Iowa,,63,60,3,3,0,,,,,12,1,12,Free Throw 2 of 2,1,Free Throw Made,,,,74,74,
2,13,07,Pat Connaughton misses a layup shot.,109491,,true,false,false,Pat,,Connaughton,,ND,,63,60,3,3,3,,,,,10,2,40,Layup Shot,4,Field Goal Missed,0,0,0,46,46,
2,13,07,Anthony Clemmons with a defensive rebound.,116762,,true,false,false,Anthony,,Clemmons,,Iowa,,63,60,3,3,1,,,,,0,,,,6,Defensive Rebound,,,,74,74,
2,13,06,Personal foul committed by Austin Burgett.,116593,,true,false,false,Austin,,Burgett,,ND,,63,60,4,3,1,,,,,1,,1,Personal,8,Foul,,,,46,46,
2,13,00,Roy Devyn Marble with a lost ball turnover: Lost Ball,97656,,true,false,false,Roy Devyn,,Marble,,Iowa,,63,60,4,3,0,,,,,12,,2,Lost Ball,7,Turnover,,,,74,74,
2,13,00,Zach Auguste makes a dunk shot. Jerian Grant with the assist.,116591,97480,true,true,false,Zach,Jerian,Auguste,Grant,ND,ND,63,62,4,3,2,,,,,4,2,48,Dunk Shot,3,Field Goal Made,0,0,0,46,46,
2,12,34,Roy Devyn Marble makes a 3-point jump shot from 24 feet out. Aaron White with the assist.,97656,110455,true,true,false,Roy Devyn,Aaron,Marble,White,Iowa,Iowa,66,62,4,3,0,,,,,15,3,45,Jump Shot,3,Field Goal Made,24,-22.5,8.9,74,74,
2,12,03,Pat Connaughton misses a 3-point jump shot from 22 feet out.,109491,,true,false,false,Pat,,Connaughton,,ND,,66,62,4,3,3,,,,,10,3,45,Jump Shot,4,Field Goal Missed,22,-21.3,6.9,46,46,
2,12,03,Aaron White with a defensive rebound.,110455,,true,false,false,Aaron,,White,,Iowa,,66,62,4,3,1,,,,,8,,,,6,Defensive Rebound,,,,74,74,
2,11,55,Roy Devyn Marble makes a layup shot.,97656,,true,false,false,Roy Devyn,,Marble,,Iowa,,68,62,4,3,0,,,,,17,2,40,Layup Shot,3,Field Goal Made,0,0,0,74,74,
2,11,25,Jerian Grant makes a layup shot.,97480,,true,false,false,Jerian,,Grant,,ND,,68,64,4,3,1,,,,,11,2,40,Layup Shot,3,Field Goal Made,0,0,0,46,46,
2,10,52,Mike Gesell misses a 3-point jump shot from 25 feet out.,116763,,true,false,false,Mike,,Gesell,,Iowa,,68,64,4,3,2,,,,,8,3,45,Jump Shot,4,Field Goal Missed,25,-9.4,23.4,74,74,
2,10,52,ND with a defensive rebound.,,,false,false,false,,,,,,,68,64,4,3,0,,,,,0,,,,6,Defensive Rebound,,,,46,46,
2,10,21,Garrick Sherman makes a layup shot. Pat Connaughton with the assist.,88941,109491,true,true,false,Garrick,Pat,Sherman,Connaughton,ND,ND,68,66,4,3,3,,,,,25,2,40,Layup Shot,3,Field Goal Made,0,0,0,46,46,
2,10,04,Mike Gesell with a out of bounds turnover: Out of Bounds,116763,,true,false,false,Mike,,Gesell,,Iowa,,68,66,4,3,2,,,,,8,,3,Out of Bounds,7,Turnover,,,,74,74,
2,9,48,Jerian Grant misses a jump shot from 6 feet out.,97480,,true,false,false,Jerian,,Grant,,ND,,68,66,4,3,1,,,,,11,2,45,Jump Shot,4,Field Goal Missed,6,-.3,6,46,46,
2,9,48,Mike Gesell with a defensive rebound.,116763,,true,false,false,Mike,,Gesell,,Iowa,,68,66,4,3,2,,,,,8,,,,6,Defensive Rebound,,,,74,74,
2,9,44,Roy Devyn Marble misses a 3-point jump shot from 23 feet out.,97656,,true,false,false,Roy Devyn,,Marble,,Iowa,,68,66,4,3,0,,,,,17,3,45,Jump Shot,4,Field Goal Missed,23,-21.5,7.2,74,74,
2,9,44,Zach McCabe with an offensive rebound.,97657,,true,false,false,Zach,,McCabe,,Iowa,,68,66,4,3,2,,,,,7,,,,5,Offensive Rebound,,,,74,74,
2,9,37,Zach McCabe misses a layup shot.,97657,,true,false,false,Zach,,McCabe,,Iowa,,68,66,4,3,2,,,,,7,2,40,Layup Shot,4,Field Goal Missed,0,0,0,74,74,
2,9,37,Austin Burgett with a defensive rebound.,116593,,true,false,false,Austin,,Burgett,,ND,,68,66,4,3,1,,,,,1,,,,6,Defensive Rebound,,,,46,46,
2,9,21,Eric Atkins misses a 3-point jump shot from 24 feet out.,97478,,true,false,false,Eric,,Atkins,,ND,,68,66,4,3,3,,,,,10,3,45,Jump Shot,4,Field Goal Missed,24,-9.9,22.2,46,46,
2,9,21,Aaron White with a defensive rebound.,110455,,true,false,false,Aaron,,White,,Iowa,,68,66,4,3,1,,,,,8,,,,6,Defensive Rebound,,,,74,74,
2,8,59,Aaron White makes a dunk shot. Zach McCabe with the assist.,110455,97657,true,true,false,Aaron,Zach,White,McCabe,Iowa,Iowa,70,66,4,3,1,,,,,10,2,48,Dunk Shot,3,Field Goal Made,0,0,0,74,74,
2,8,59,Shooting foul committed by Pat Connaughton.,109491,,true,false,false,Pat,,Connaughton,,ND,,70,66,5,3,4,,,,,10,,2,Shooting,8,Foul,,,,46,46,
2,8,59,Aaron White makes free throw 1 of 1.,110455,,true,false,false,Aaron,,White,,Iowa,,71,66,5,3,1,,,,,11,1,10,Free Throw 1 of 1,1,Free Throw Made,,,,74,74,
2,8,45,Austin Burgett makes a jump shot from 15 feet out. Jerian Grant with the assist.,116593,97480,true,true,false,Austin,Jerian,Burgett,Grant,ND,ND,71,68,5,3,1,,,,,3,2,45,Jump Shot,3,Field Goal Made,15,-4.7,14,46,46,
2,8,39,Anthony Clemmons with a traveling turnover: Traveling,116762,,true,false,false,Anthony,,Clemmons,,Iowa,,71,68,5,3,1,,,,,0,,4,Traveling,7,Turnover,,,,74,74,
2,8,15,Demetrius Jackson makes a 3-point jump shot from 23 feet out. Jerian Grant with the assist.,120755,97480,true,true,false,Demetrius,Jerian,Jackson,Grant,ND,ND,71,71,5,3,0,,,,,8,3,45,Jump Shot,3,Field Goal Made,23,20.8,8.6,46,46,
2,8,05,Jarrod Uthoff misses a jump shot from 8 feet out.,110237,,true,false,false,Jarrod,,Uthoff,,Iowa,,71,71,5,3,1,,,,,6,2,45,Jump Shot,4,Field Goal Missed,8,-7.9,2.6,74,74,
2,8,05,Aaron White with an offensive rebound.,110455,,true,false,false,Aaron,,White,,Iowa,,71,71,5,3,1,,,,,11,,,,5,Offensive Rebound,,,,74,74,
2,8,00,Aaron White makes a jump shot from 4 feet out.,110455,,true,false,false,Aaron,,White,,Iowa,,73,71,5,3,1,,,,,13,2,45,Jump Shot,3,Field Goal Made,4,1.4,3.3,74,74,
2,7,41,Jerian Grant misses a 3-point jump shot from 26 feet out.,97480,,true,false,false,Jerian,,Grant,,ND,,73,71,5,3,1,,,,,11,3,45,Jump Shot,4,Field Goal Missed,26,-15.6,21,46,46,
2,7,41,Mike Gesell with a defensive rebound.,116763,,true,false,false,Mike,,Gesell,,Iowa,,73,71,5,3,2,,,,,8,,,,6,Defensive Rebound,,,,74,74,
2,7,32,Jarrod Uthoff makes a 3-point jump shot from 22 feet out. Aaron White with the assist.,110237,110455,true,true,false,Jarrod,Aaron,Uthoff,White,Iowa,Iowa,76,71,5,3,1,,,,,9,3,45,Jump Shot,3,Field Goal Made,22,-22,3.8,74,74,
2,7,29,ND take a 20-second timeout.,,,false,false,false,,,,,,,76,71,5,3,0,,,,,0,,2,Short,11,Timeout,,,,46,46,
2,7,08,Eric Atkins makes a jump shot from 8 feet out.,97478,,true,false,false,Eric,,Atkins,,ND,,76,73,5,3,3,,,,,12,2,45,Jump Shot,3,Field Goal Made,8,2.3,7.2,46,46,
2,6,49,Adam Woodbury with a lost ball turnover: Lost Ball,116765,,true,false,false,Adam,,Woodbury,,Iowa,,76,73,5,3,1,,,,,4,,2,Lost Ball,7,Turnover,,,,74,74,
2,6,46,Jerian Grant makes a dunk shot.,97480,,true,false,false,Jerian,,Grant,,ND,,76,75,5,3,1,,,,,13,2,48,Dunk Shot,3,Field Goal Made,0,0,0,46,46,
2,6,21,Adam Woodbury makes a layup shot. Anthony Clemmons with the assist.,116765,116762,true,true,false,Adam,Anthony,Woodbury,Clemmons,Iowa,Iowa,78,75,5,3,1,,,,,6,2,40,Layup Shot,3,Field Goal Made,0,0,0,74,74,
2,5,57,Pat Connaughton misses a 3-point jump shot from 23 feet out.,109491,,true,false,false,Pat,,Connaughton,,ND,,78,75,5,3,4,,,,,10,3,45,Jump Shot,4,Field Goal Missed,23,1.8,22.7,46,46,
2,5,57,Aaron White with a defensive rebound.,110455,,true,false,false,Aaron,,White,,Iowa,,78,75,5,3,1,,,,,13,,,,6,Defensive Rebound,,,,74,74,
2,5,49,Anthony Clemmons misses a layup shot.,116762,,true,false,false,Anthony,,Clemmons,,Iowa,,78,75,5,3,1,,,,,0,2,40,Layup Shot,4,Field Goal Missed,0,0,0,74,74,
2,5,49,Anthony Clemmons with an offensive rebound.,116762,,true,false,false,Anthony,,Clemmons,,Iowa,,78,75,5,3,1,,,,,0,,,,5,Offensive Rebound,,,,74,74,
2,5,43,Official TV timeout.,,,false,false,false,,,,,,,78,75,5,3,0,,,,,0,,3,Official TV,11,Timeout,,,,74,74,
2,5,30,Adam Woodbury with a 3 second violation turnover: 3 Second Violation,116765,,true,false,false,Adam,,Woodbury,,Iowa,,78,75,5,3,1,,,,,6,,8,3 Second Violation,7,Turnover,,,,74,74,
2,4,55,Pat Connaughton makes a layup shot.,109491,,true,false,false,Pat,,Connaughton,,ND,,78,77,5,3,4,,,,,12,2,40,Layup Shot,3,Field Goal Made,0,0,0,46,46,
2,4,33,Zach McCabe makes a layup shot. Aaron White with the assist.,97657,110455,true,true,false,Zach,Aaron,McCabe,White,Iowa,Iowa,80,77,5,3,2,,,,,9,2,40,Layup Shot,3,Field Goal Made,0,0,0,74,74,
2,4,33,Shooting foul committed by Jerian Grant.,97480,,true,false,false,Jerian,,Grant,,ND,,80,77,6,3,2,,,,,13,,2,Shooting,8,Foul,,,,46,46,
2,4,33,Zach McCabe makes free throw 1 of 1.,97657,,true,false,false,Zach,,McCabe,,Iowa,,81,77,6,3,2,,,,,10,1,10,Free Throw 1 of 1,1,Free Throw Made,,,,74,74,
2,4,11,Personal foul committed by Zach McCabe.,97657,,true,false,false,Zach,,McCabe,,Iowa,,81,77,6,4,3,,,,,10,,1,Personal,8,Foul,,,,74,74,
2,4,03,Garrick Sherman misses a jump shot from 9 feet out.,88941,,true,false,false,Garrick,,Sherman,,ND,,81,77,6,4,3,,,,,25,2,45,Jump Shot,4,Field Goal Missed,9,4,8,46,46,
2,4,03,Jarrod Uthoff with a defensive rebound.,110237,,true,false,false,Jarrod,,Uthoff,,Iowa,,81,77,6,4,1,,,,,9,,,,6,Defensive Rebound,,,,74,74,
2,3,51,Personal foul committed by Jerian Grant.,97480,,true,false,false,Jerian,,Grant,,ND,,81,77,7,4,3,,,,,13,,1,Personal,8,Foul,,,,46,46,
2,3,51,Official TV timeout.,,,false,false,false,,,,,,,81,77,7,4,0,,,,,0,,3,Official TV,11,Timeout,,,,74,74,
2,3,51,Jarrod Uthoff makes free throw 1st of 1-and-1.,110237,,true,false,false,Jarrod,,Uthoff,,Iowa,,82,77,7,4,1,,,,,10,1,8,Free Throw 1st of 1-and-1,1,Free Throw Made,,,,74,74,
2,3,51,Jarrod Uthoff makes free throw 2nd of 1-and-1.,110237,,true,false,false,Jarrod,,Uthoff,,Iowa,,83,77,7,4,1,,,,,11,1,9,Free Throw 2nd of 1-and-1,1,Free Throw Made,,,,74,74,
2,3,29,Garrick Sherman makes a layup shot. Jerian Grant with the assist.,88941,97480,true,true,false,Garrick,Jerian,Sherman,Grant,ND,ND,83,79,7,4,3,,,,,27,2,40,Layup Shot,3,Field Goal Made,0,0,0,46,46,
2,2,57,Roy Devyn Marble misses a jump shot from 16 feet out.,97656,,true,false,false,Roy Devyn,,Marble,,Iowa,,83,79,7,4,0,,,,,17,2,45,Jump Shot,4,Field Goal Missed,16,8.1,14.2,74,74,
2,2,57,Aaron White with an offensive rebound.,110455,,true,false,false,Aaron,,White,,Iowa,,83,79,7,4,1,,,,,13,,,,5,Offensive Rebound,,,,74,74,
2,2,53,Aaron White makes a layup shot.,110455,,true,false,false,Aaron,,White,,Iowa,,85,79,7,4,1,,,,,15,2,40,Layup Shot,3,Field Goal Made,0,0,0,74,74,
2,2,36,Eric Atkins makes a 3-point jump shot from 23 feet out. Pat Connaughton with the assist.,97478,109491,true,true,false,Eric,Pat,Atkins,Connaughton,ND,ND,85,82,7,4,3,,,,,15,3,45,Jump Shot,3,Field Goal Made,23,-22.2,4.3,46,46,
2,2,28,Personal foul committed by Demetrius Jackson.,120755,,true,false,false,Demetrius,,Jackson,,ND,,85,82,8,4,1,,,,,8,,1,Personal,8,Foul,,,,46,46,
2,2,28,Mike Gesell makes free throw 1st of 1-and-1.,116763,,true,false,false,Mike,,Gesell,,Iowa,,86,82,8,4,2,,,,,9,1,8,Free Throw 1st of 1-and-1,1,Free Throw Made,,,,74,74,
2,2,28,Mike Gesell makes free throw 2nd of 1-and-1.,116763,,true,false,false,Mike,,Gesell,,Iowa,,87,82,8,4,2,,,,,10,1,9,Free Throw 2nd of 1-and-1,1,Free Throw Made,,,,74,74,
2,2,07,Shooting foul committed by Zach McCabe.,97657,,true,false,false,Zach,,McCabe,,Iowa,,87,82,8,5,4,,,,,10,,2,Shooting,8,Foul,,,,74,74,
2,2,07,Demetrius Jackson misses free throw 1 of 2.,120755,,true,false,false,Demetrius,,Jackson,,ND,,87,82,8,5,1,,,,,8,1,11,Free Throw 1 of 2,2,Free Throw Missed,,,,46,46,
2,2,07,ND with an offensive rebound.,,,false,false,false,,,,,,,87,82,8,5,0,,,,,0,,,,5,Offensive Rebound,,,,46,46,
2,2,07,Demetrius Jackson makes free throw 2 of 2.,120755,,true,false,false,Demetrius,,Jackson,,ND,,87,83,8,5,1,,,,,9,1,12,Free Throw 2 of 2,1,Free Throw Made,,,,46,46,
2,1,50,Aaron White makes a layup shot. Mike Gesell with the assist.,110455,116763,true,true,false,Aaron,Mike,White,Gesell,Iowa,Iowa,89,83,8,5,1,,,,,17,2,40,Layup Shot,3,Field Goal Made,0,0,0,74,74,
2,1,50,Shooting foul committed by Garrick Sherman.,88941,,true,false,false,Garrick,,Sherman,,ND,,89,83,9,5,4,,,,,27,,2,Shooting,8,Foul,,,,46,46,
2,1,50,Aaron White makes free throw 1 of 1.,110455,,true,false,false,Aaron,,White,,Iowa,,90,83,9,5,1,,,,,18,1,10,Free Throw 1 of 1,1,Free Throw Made,,,,74,74,
2,1,35,Demetrius Jackson misses a 3-point jump shot from 22 feet out.,120755,,true,false,false,Demetrius,,Jackson,,ND,,90,83,9,5,1,,,,,9,3,45,Jump Shot,4,Field Goal Missed,22,21.9,2.5,46,46,
2,1,35,Garrick Sherman with an offensive rebound.,88941,,true,false,false,Garrick,,Sherman,,ND,,90,83,9,5,4,,,,,27,,,,5,Offensive Rebound,,,,46,46,
2,1,28,Garrick Sherman misses a layup shot.,88941,,true,false,false,Garrick,,Sherman,,ND,,90,83,9,5,4,,,,,27,2,40,Layup Shot,4,Field Goal Missed,0,0,0,46,46,
2,1,28,Garrick Sherman with an offensive rebound.,88941,,true,false,false,Garrick,,Sherman,,ND,,90,83,9,5,4,,,,,27,,,,5,Offensive Rebound,,,,46,46,
2,1,23,Garrick Sherman makes a layup shot.,88941,,true,false,false,Garrick,,Sherman,,ND,,90,85,9,5,4,,,,,29,2,40,Layup Shot,3,Field Goal Made,0,0,0,46,46,
2,1,11,Personal foul committed by Jerian Grant.,97480,,true,false,false,Jerian,,Grant,,ND,,90,85,10,5,4,,,,,13,,1,Personal,8,Foul,,,,46,46,
2,1,11,Jarrod Uthoff misses free throw 1 of 2.,110237,,true,false,false,Jarrod,,Uthoff,,Iowa,,90,85,10,5,1,,,,,11,1,11,Free Throw 1 of 2,2,Free Throw Missed,,,,74,74,
2,1,11,Iowa with an offensive rebound.,,,false,false,false,,,,,,,90,85,10,5,0,,,,,0,,,,5,Offensive Rebound,,,,74,74,
2,1,11,Jarrod Uthoff makes free throw 2 of 2.,110237,,true,false,false,Jarrod,,Uthoff,,Iowa,,91,85,10,5,1,,,,,12,1,12,Free Throw 2 of 2,1,Free Throw Made,,,,74,74,
2,1,02,Shooting foul committed by Melsahn Basabe.,97658,,true,false,false,Melsahn,,Basabe,,Iowa,,91,85,10,6,1,,,,,6,,2,Shooting,8,Foul,,,,74,74,
2,1,02,Eric Atkins misses free throw 1 of 2.,97478,,true,false,false,Eric,,Atkins,,ND,,91,85,10,6,3,,,,,15,1,11,Free Throw 1 of 2,2,Free Throw Missed,,,,46,46,
2,1,02,ND with an offensive rebound.,,,false,false,false,,,,,,,91,85,10,6,0,,,,,0,,,,5,Offensive Rebound,,,,46,46,
2,1,02,Eric Atkins makes free throw 2 of 2.,97478,,true,false,false,Eric,,Atkins,,ND,,91,86,10,6,3,,,,,16,1,12,Free Throw 2 of 2,1,Free Throw Made,,,,46,46,
2,1,02,ND take a 20-second timeout.,,,false,false,false,,,,,,,91,86,10,6,0,,,,,0,,2,Short,11,Timeout,,,,46,46,
2,0,56.1,Jarrod Uthoff with a lost ball turnover: Lost Ball,110237,,true,false,false,Jarrod,,Uthoff,,Iowa,,91,86,10,6,1,,,,,12,,2,Lost Ball,7,Turnover,,,,74,74,
2,0,43.1,Eric Atkins misses a jump shot from 14 feet out.,97478,,true,false,false,Eric,,Atkins,,ND,,91,86,10,6,3,,,,,16,2,45,Jump Shot,4,Field Goal Missed,14,10.6,9.6,46,46,
2,0,43.1,Eric Atkins with an offensive rebound.,97478,,true,false,false,Eric,,Atkins,,ND,,91,86,10,6,3,,,,,16,,,,5,Offensive Rebound,,,,46,46,
2,0,39.3,Eric Atkins makes a jump shot from 11 feet out.,97478,,true,false,false,Eric,,Atkins,,ND,,91,88,10,6,3,,,,,18,2,45,Jump Shot,3,Field Goal Made,11,9,7,46,46,
2,0,38.9,ND take a 20-second timeout.,,,false,false,false,,,,,,,91,88,10,6,0,,,,,0,,2,Short,11,Timeout,,,,46,46,
2,0,37.5,Personal foul committed by Austin Burgett.,116593,,true,false,false,Austin,,Burgett,,ND,,91,88,11,6,2,,,,,3,,1,Personal,8,Foul,,,,46,46,
2,0,37.5,Jarrod Uthoff makes free throw 1 of 2.,110237,,true,false,false,Jarrod,,Uthoff,,Iowa,,92,88,11,6,1,,,,,13,1,11,Free Throw 1 of 2,1,Free Throw Made,,,,74,74,
2,0,37.5,Jarrod Uthoff makes free throw 2 of 2.,110237,,true,false,false,Jarrod,,Uthoff,,Iowa,,93,88,11,6,1,,,,,14,1,12,Free Throw 2 of 2,1,Free Throw Made,,,,74,74,
2,0,27.4,Pat Connaughton misses a 3-point jump shot from 24 feet out.,109491,,true,false,false,Pat,,Connaughton,,ND,,93,88,11,6,4,,,,,12,3,45,Jump Shot,4,Field Goal Missed,24,-22.7,7.6,46,46,
2,0,27.4,Roy Devyn Marble with a defensive rebound.,97656,,true,false,false,Roy Devyn,,Marble,,Iowa,,93,88,11,6,0,,,,,17,,,,6,Defensive Rebound,,,,74,74,
2,0,20.0,Jarrod Uthoff makes a dunk shot. Aaron White with the assist.,110237,110455,true,true,false,Jarrod,Aaron,Uthoff,White,Iowa,Iowa,95,88,11,6,1,,,,,16,2,48,Dunk Shot,3,Field Goal Made,0,0,0,74,74,
2,0,12.7,Shooting foul committed by Mike Gesell.,116763,,true,false,false,Mike,,Gesell,,Iowa,,95,88,11,7,3,,,,,10,,2,Shooting,8,Foul,,,,74,74,
2,0,12.7,Eric Atkins makes free throw 1 of 2.,97478,,true,false,false,Eric,,Atkins,,ND,,95,89,11,7,3,,,,,19,1,11,Free Throw 1 of 2,1,Free Throw Made,,,,46,46,
2,0,12.7,Eric Atkins makes free throw 2 of 2.,97478,,true,false,false,Eric,,Atkins,,ND,,95,90,11,7,3,,,,,20,1,12,Free Throw 2 of 2,1,Free Throw Made,,,,46,46,
2,0,11.9,Personal foul committed by Eric Atkins.,97478,,true,false,false,Eric,,Atkins,,ND,,95,90,12,7,4,,,,,20,,1,Personal,8,Foul,,,,46,46,
2,0,11.9,Jarrod Uthoff makes free throw 1 of 2.,110237,,true,false,false,Jarrod,,Uthoff,,Iowa,,96,90,12,7,1,,,,,17,1,11,Free Throw 1 of 2,1,Free Throw Made,,,,74,74,
2,0,11.9,Jarrod Uthoff misses free throw 2 of 2.,110237,,true,false,false,Jarrod,,Uthoff,,Iowa,,96,90,12,7,1,,,,,17,1,12,Free Throw 2 of 2,2,Free Throw Missed,,,,74,74,
2,0,11.9,Pat Connaughton with a defensive rebound.,109491,,true,false,false,Pat,,Connaughton,,ND,,96,90,12,7,4,,,,,12,,,,6,Defensive Rebound,,,,46,46,
2,0,11.2,Austin Burgett misses a jump shot from 12 feet out.,116593,,true,false,false,Austin,,Burgett,,ND,,96,90,12,7,2,,,,,3,2,45,Jump Shot,4,Field Goal Missed,12,-6.4,10.4,46,46,
2,0,11.2,Eric Atkins with an offensive rebound.,97478,,true,false,false,Eric,,Atkins,,ND,,96,90,12,7,4,,,,,20,,,,5,Offensive Rebound,,,,46,46,
2,0,06.8,Eric Atkins makes a 3-point jump shot from 23 feet out.,97478,,true,false,false,Eric,,Atkins,,ND,,96,93,12,7,4,,,,,23,3,45,Jump Shot,3,Field Goal Made,23,-14,18.6,46,46,
2,0,01.0,Personal foul committed by Austin Burgett.,116593,,true,false,false,Austin,,Burgett,,ND,,96,93,13,7,3,,,,,3,,1,Personal,8,Foul,,,,46,46,
2,0,01.0,Aaron White makes free throw 1 of 2.,110455,,true,false,false,Aaron,,White,,Iowa,,97,93,13,7,1,,,,,19,1,11,Free Throw 1 of 2,1,Free Throw Made,,,,74,74,
2,0,01.0,Aaron White makes free throw 2 of 2.,110455,,true,false,false,Aaron,,White,,Iowa,,98,93,13,7,1,,,,,20,1,12,Free Throw 2 of 2,1,Free Throw Made,,,,74,74,
2,0,00,End of the 2nd Half,,,false,false,false,,,,,,,98,93,13,7,0,,,,,0,,,,15,End Period,,,,74,74,
2,0,00,End of the Game,,,false,false,false,,,,,,,98,93,13,7,0,,,,,0,,,,19,Game Over,,,,74,74,
