half,time-minutes,time-seconds,details,player1-id,player2-id,player1-linkable,player2-linkable,player3-linkable,player-first-name-1,player-first-name-2,player-last-name-1,player-last-name-2,player-team-alias-1,player-team-alias-2,home-score,visitor-score,visitor-fouls,home-fouls,player-fouls,fastbreak,in-paint,second-chance,off-turnover,player-score,points-type,detail-id,detail-desc,event-id,event-desc,distance,x-coord,y-coord,team-id-1,team-id-2,team-id-3
2,18,54,Noah Vonleh with a defensive rebound.,121075,,true,false,false,Noah,,Vonleh,,Ind,,47,45,0,0,2,,,,,6,,,,6,Defensive Rebound,,,,73,73,
2,18,35,Evan Gordon misses a jump shot from 15 feet out.,88325,,true,false,false,Evan,,Gordon,,Ind,,47,45,0,0,0,,,,,11,2,45,Jump Shot,4,Field Goal Missed,15,-11,10,73,73,
2,18,35,Eric Atkins with a defensive rebound.,97478,,true,false,false,Eric,,Atkins,,ND,,47,45,0,0,0,,,,,5,,,,6,Defensive Rebound,,,,46,46,
2,18,29,Demetrius Jackson misses a 3-point jump shot from 23 feet out.,120755,,true,false,false,Demetrius,,Jackson,,ND,,47,45,0,0,1,,,,,2,3,45,Jump Shot,4,Field Goal Missed,23,23,3,46,46,
2,18,29,Yogi Ferrell with a defensive rebound.,116724,,true,false,false,Yogi,,Ferrell,,Ind,,47,45,0,0,0,,,,,2,,,,6,Defensive Rebound,,,,73,73,
2,18,20,Yogi Ferrell makes a jump shot from 10 feet out.,116724,,true,false,false,Yogi,,Ferrell,,Ind,,47,47,0,0,0,,,,,4,2,45,Jump Shot,3,Field Goal Made,10,-2.8,10.1,73,73,
2,17,57,Demetrius Jackson misses a layup shot.,120755,,true,false,false,Demetrius,,Jackson,,ND,,47,47,0,0,1,,,,,2,2,40,Layup Shot,4,Field Goal Missed,0,0,0,46,46,
2,17,57,Noah Vonleh with a defensive rebound.,121075,,true,false,false,Noah,,Vonleh,,Ind,,47,47,0,0,2,,,,,6,,,,6,Defensive Rebound,,,,73,73,
2,17,48,Will Sheehey misses a 3-point jump shot from 24 feet out.,97590,,true,false,false,Will,,Sheehey,,Ind,,47,47,0,0,2,,,,,16,3,45,Jump Shot,4,Field Goal Missed,24,6.4,23.5,73,73,
2,17,48,Jerian Grant with a defensive rebound.,97480,,true,false,false,Jerian,,Grant,,ND,,47,47,0,0,0,,,,,13,,,,6,Defensive Rebound,,,,46,46,
2,17,23,Shooting foul committed by Evan Gordon.,88325,,true,false,false,Evan,,Gordon,,Ind,,47,47,1,0,1,,,,,11,,2,Shooting,8,Foul,,,,73,73,
2,17,23,Jerian Grant makes free throw 1 of 2.,97480,,true,false,false,Jerian,,Grant,,ND,,48,47,1,0,0,,,,,14,1,11,Free Throw 1 of 2,1,Free Throw Made,,,,46,46,
2,17,23,Jerian Grant makes free throw 2 of 2.,97480,,true,false,false,Jerian,,Grant,,ND,,49,47,1,0,0,,,,,15,1,12,Free Throw 2 of 2,1,Free Throw Made,,,,46,46,
2,17,02,Noah Vonleh makes a dunk shot. Jeremy Hollowell with the assist.,121075,116726,true,true,false,Noah,Jeremy,Vonleh,Hollowell,Ind,Ind,49,49,1,0,2,,,,,8,2,48,Dunk Shot,3,Field Goal Made,0,0,0,73,73,
2,16,45,Personal foul committed by Noah Vonleh.,121075,,true,false,false,Noah,,Vonleh,,Ind,,49,49,2,0,3,,,,,8,,1,Personal,8,Foul,,,,73,73,
2,16,39,Pat Connaughton makes a 3-point jump shot from 24 feet out. Jerian Grant with the assist.,109491,97480,true,true,false,Pat,Jerian,Connaughton,Grant,ND,ND,52,49,2,0,2,,,,,3,3,45,Jump Shot,3,Field Goal Made,24,15,18,46,46,
2,16,12,Evan Gordon misses a 3-point jump shot from 26 feet out.,88325,,true,false,false,Evan,,Gordon,,Ind,,52,49,2,0,1,,,,,11,3,45,Jump Shot,4,Field Goal Missed,26,-19,17.4,73,73,
2,16,12,Garrick Sherman with a defensive rebound.,88941,,true,false,false,Garrick,,Sherman,,ND,,52,49,2,0,2,,,,,13,,,,6,Defensive Rebound,,,,46,46,
2,16,08,Eric Atkins misses a layup shot.,97478,,true,false,false,Eric,,Atkins,,ND,,52,49,2,0,0,,,,,5,2,40,Layup Shot,4,Field Goal Missed,0,0,0,46,46,
2,16,08,Ind with a defensive rebound.,,,false,false,false,,,,,,,52,49,2,0,0,,,,,0,,,,6,Defensive Rebound,,,,73,73,
2,15,48,Jeremy Hollowell misses a jump shot from 16 feet out.,116726,,true,false,false,Jeremy,,Hollowell,,Ind,,52,49,2,0,1,,,,,3,2,45,Jump Shot,4,Field Goal Missed,16,-15.7,4.3,73,73,
2,15,48,Pat Connaughton with a defensive rebound.,109491,,true,false,false,Pat,,Connaughton,,ND,,52,49,2,0,2,,,,,3,,,,6,Defensive Rebound,,,,46,46,
2,15,48,Personal foul committed by Devin Davis.,121078,,true,false,false,Devin,,Davis,,Ind,,52,49,3,0,1,,,,,0,,1,Personal,8,Foul,,,,73,73,
2,15,48,Official TV timeout.,,,false,false,false,,,,,,,52,49,3,0,0,,,,,0,,3,Official TV,11,Timeout,,,,46,46,
2,15,18,Garrick Sherman makes a layup shot.,88941,,true,false,false,Garrick,,Sherman,,ND,,54,49,3,0,2,,,,,15,2,40,Layup Shot,3,Field Goal Made,0,0,0,46,46,
2,15,18,Shooting foul committed by Devin Davis.,121078,,true,false,false,Devin,,Davis,,Ind,,54,49,4,0,2,,,,,0,,2,Shooting,8,Foul,,,,73,73,
2,15,18,Garrick Sherman misses free throw 1 of 1.,88941,,true,false,false,Garrick,,Sherman,,ND,,54,49,4,0,2,,,,,15,1,10,Free Throw 1 of 1,2,Free Throw Missed,,,,46,46,
2,15,18,Troy Williams with a defensive rebound.,121077,,true,false,false,Troy,,Williams,,Ind,,54,49,4,0,2,,,,,0,,,,6,Defensive Rebound,,,,73,73,
2,14,58,Troy Williams misses a jump shot from 18 feet out.,121077,,true,false,false,Troy,,Williams,,Ind,,54,49,4,0,2,,,,,0,2,45,Jump Shot,4,Field Goal Missed,18,13,12,73,73,
2,14,58,Ind with an offensive rebound.,,,false,false,false,,,,,,,54,49,4,0,0,,,,,0,,,,5,Offensive Rebound,,,,73,73,
2,14,42,Yogi Ferrell misses a 3-point jump shot from 24 feet out.,116724,,true,false,false,Yogi,,Ferrell,,Ind,,54,49,4,0,0,,,,,4,3,45,Jump Shot,4,Field Goal Missed,24,-17.1,17.3,73,73,
2,14,42,Tom Knight with a defensive rebound.,88670,,true,false,false,Tom,,Knight,,ND,,54,49,4,0,2,,,,,8,,,,6,Defensive Rebound,,,,46,46,
2,14,42,Jerian Grant misses a 3-point jump shot from 23 feet out.,97480,,true,false,false,Jerian,,Grant,,ND,,54,49,4,0,0,,,,,15,3,45,Jump Shot,4,Field Goal Missed,23,-17,16,46,46,
2,14,42,ND with an offensive rebound.,,,false,false,false,,,,,,,54,49,4,0,0,,,,,0,,,,5,Offensive Rebound,,,,46,46,
2,14,26,Garrick Sherman with a lost ball turnover: Lost Ball,88941,,true,false,false,Garrick,,Sherman,,ND,,54,49,4,0,2,,,,,15,,2,Lost Ball,7,Turnover,,,,46,46,
2,14,24,Personal foul committed by Jerian Grant.,97480,,true,false,false,Jerian,,Grant,,ND,,54,49,4,1,1,,,,,15,,1,Personal,8,Foul,,,,46,46,
2,14,01,Will Sheehey misses a jump shot from 13 feet out.,97590,,true,false,false,Will,,Sheehey,,Ind,,54,49,4,1,2,,,,,16,2,45,Jump Shot,4,Field Goal Missed,13,3,13,73,73,
2,14,01,Eric Atkins with a defensive rebound.,97478,,true,false,false,Eric,,Atkins,,ND,,54,49,4,1,0,,,,,5,,,,6,Defensive Rebound,,,,46,46,
2,13,54,Eric Atkins with a lost ball turnover: Lost Ball,97478,,true,false,false,Eric,,Atkins,,ND,,54,49,4,1,0,,,,,5,,2,Lost Ball,7,Turnover,,,,46,46,
2,13,49,Will Sheehey makes a jump shot from 17 feet out.,97590,,true,false,false,Will,,Sheehey,,Ind,,54,51,4,1,2,,,,,18,2,45,Jump Shot,3,Field Goal Made,17,12.8,11.8,73,73,
2,13,26,Personal foul committed by Will Sheehey.,97590,,true,false,false,Will,,Sheehey,,Ind,,54,51,5,1,3,,,,,18,,1,Personal,8,Foul,,,,73,73,
2,13,13,Pat Connaughton makes a layup shot.,109491,,true,false,false,Pat,,Connaughton,,ND,,56,51,5,1,2,,,,,5,2,40,Layup Shot,3,Field Goal Made,0,0,0,46,46,
2,12,49,Troy Williams misses a jump shot from 20 feet out.,121077,,true,false,false,Troy,,Williams,,Ind,,56,51,5,1,2,,,,,0,2,45,Jump Shot,4,Field Goal Missed,20,-13.9,13.9,73,73,
2,12,49,Evan Gordon with an offensive rebound.,88325,,true,false,false,Evan,,Gordon,,Ind,,56,51,5,1,1,,,,,11,,,,5,Offensive Rebound,,,,73,73,
2,12,47,Evan Gordon misses a jump shot from 13 feet out.,88325,,true,false,false,Evan,,Gordon,,Ind,,56,51,5,1,1,,,,,11,2,45,Jump Shot,4,Field Goal Missed,13,4,12,73,73,
2,12,47,Troy Williams with an offensive rebound.,121077,,true,false,false,Troy,,Williams,,Ind,,56,51,5,1,2,,,,,0,,,,5,Offensive Rebound,,,,73,73,
2,12,47,Troy Williams misses a tip shot from 6 feet out.,121077,,true,false,false,Troy,,Williams,,Ind,,56,51,5,1,2,,,,,0,2,53,Tip Shot,4,Field Goal Missed,6,2,6,73,73,
2,12,47,Tom Knight with a defensive rebound.,88670,,true,false,false,Tom,,Knight,,ND,,56,51,5,1,2,,,,,8,,,,6,Defensive Rebound,,,,46,46,
2,12,38,Pat Connaughton makes a 3-point dunk shot. Demetrius Jackson with the assist.,109491,120755,true,true,false,Pat,Demetrius,Connaughton,Jackson,ND,ND,59,51,5,1,2,,,,,8,3,48,Dunk Shot,3,Field Goal Made,0,0,0,46,46,
2,12,36,Ind take a full timeout.,,,false,false,false,,,,,,,59,51,5,1,0,,,,,0,,1,Regular,11,Timeout,,,,73,73,
2,12,20,Stanford Robinson with a bad pass turnover: Bad Pass,121080,,true,false,false,Stanford,,Robinson,,Ind,,59,51,5,1,0,,,,,0,,1,Bad Pass,7,Turnover,,,,73,73,
2,12,01,Zach Auguste misses a layup shot.,116591,,true,false,false,Zach,,Auguste,,ND,,59,51,5,1,1,,,,,6,2,40,Layup Shot,4,Field Goal Missed,0,0,0,46,46,
2,12,01,Austin Etherington with a defensive rebound.,109543,,true,false,false,Austin,,Etherington,,Ind,,59,51,5,1,1,,,,,3,,,,6,Defensive Rebound,,,,73,73,
2,11,53,Yogi Ferrell makes a 3-point jump shot from 24 feet out.,116724,,true,false,false,Yogi,,Ferrell,,Ind,,59,54,5,1,0,,,,,7,3,45,Jump Shot,3,Field Goal Made,24,12,20.5,73,73,
2,11,17,Pat Connaughton misses a 3-point jump shot from 25 feet out.,109491,,true,false,false,Pat,,Connaughton,,ND,,59,54,5,1,2,,,,,8,3,45,Jump Shot,4,Field Goal Missed,25,13.7,20.7,46,46,
2,11,17,Austin Etherington with a defensive rebound.,109543,,true,false,false,Austin,,Etherington,,Ind,,59,54,5,1,1,,,,,3,,,,6,Defensive Rebound,,,,73,73,
2,11,06,Luke Fischer misses a layup shot.,121082,,true,false,false,Luke,,Fischer,,Ind,,59,54,5,1,1,,,,,0,2,40,Layup Shot,4,Field Goal Missed,0,0,0,73,73,
2,11,06,Pat Connaughton with a defensive rebound.,109491,,true,false,false,Pat,,Connaughton,,ND,,59,54,5,1,2,,,,,8,,,,6,Defensive Rebound,,,,46,46,
2,11,00,ND take a full timeout.,,,false,false,false,,,,,,,59,54,5,1,0,,,,,0,,1,Regular,11,Timeout,,,,46,46,
2,10,39,Eric Atkins misses a 3-point jump shot from 26 feet out.,97478,,true,false,false,Eric,,Atkins,,ND,,59,54,5,1,0,,,,,5,3,45,Jump Shot,4,Field Goal Missed,26,-18,18,46,46,
2,10,39,Ind with a defensive rebound.,,,false,false,false,,,,,,,59,54,5,1,0,,,,,0,,,,6,Defensive Rebound,,,,73,73,
2,10,39,Personal foul committed by Garrick Sherman.,88941,,true,false,false,Garrick,,Sherman,,ND,,59,54,5,2,3,,,,,15,,1,Personal,8,Foul,,,,46,46,
2,10,39,Official TV timeout.,,,false,false,false,,,,,,,59,54,5,2,0,,,,,0,,3,Official TV,11,Timeout,,,,46,46,
2,10,20,Luke Fischer misses a jump shot from 7 feet out.,121082,,true,false,false,Luke,,Fischer,,Ind,,59,54,5,2,1,,,,,0,2,45,Jump Shot,4,Field Goal Missed,7,0,7,73,73,
2,10,20,Stanford Robinson with an offensive rebound.,121080,,true,false,false,Stanford,,Robinson,,Ind,,59,54,5,2,0,,,,,0,,,,5,Offensive Rebound,,,,73,73,
2,10,19,Shooting foul committed by Eric Atkins.,97478,,true,false,false,Eric,,Atkins,,ND,,59,54,5,3,1,,,,,5,,2,Shooting,8,Foul,,,,46,46,
2,10,19,Stanford Robinson makes free throw 1 of 2.,121080,,true,false,false,Stanford,,Robinson,,Ind,,59,55,5,3,0,,,,,1,1,11,Free Throw 1 of 2,1,Free Throw Made,,,,73,73,
2,10,19,Stanford Robinson makes free throw 2 of 2.,121080,,true,false,false,Stanford,,Robinson,,Ind,,59,56,5,3,0,,,,,2,1,12,Free Throw 2 of 2,1,Free Throw Made,,,,73,73,
2,10,05,Jerian Grant misses a layup shot.,97480,,true,false,false,Jerian,,Grant,,ND,,59,56,5,3,1,,,,,15,2,40,Layup Shot,4,Field Goal Missed,0,0,0,46,46,
2,10,05,Austin Etherington with a defensive rebound.,109543,,true,false,false,Austin,,Etherington,,Ind,,59,56,5,3,1,,,,,3,,,,6,Defensive Rebound,,,,73,73,
2,9,54,Stanford Robinson makes a layup shot.,121080,,true,false,false,Stanford,,Robinson,,Ind,,59,58,5,3,0,,,,,4,2,40,Layup Shot,3,Field Goal Made,0,0,0,73,73,
2,9,27,Shooting foul committed by Stanford Robinson.,121080,,true,false,false,Stanford,,Robinson,,Ind,,59,58,6,3,1,,,,,4,,2,Shooting,8,Foul,,,,73,73,
2,9,27,Jerian Grant makes free throw 1 of 2.,97480,,true,false,false,Jerian,,Grant,,ND,,60,58,6,3,1,,,,,16,1,11,Free Throw 1 of 2,1,Free Throw Made,,,,46,46,
2,9,27,Jerian Grant makes free throw 2 of 2.,97480,,true,false,false,Jerian,,Grant,,ND,,61,58,6,3,1,,,,,17,1,12,Free Throw 2 of 2,1,Free Throw Made,,,,46,46,
2,9,17,Will Sheehey makes a jump shot from 14 feet out.,97590,,true,false,false,Will,,Sheehey,,Ind,,61,60,6,3,3,,,,,20,2,45,Jump Shot,3,Field Goal Made,14,8.4,11.5,73,73,
2,9,03,Pat Connaughton makes a dunk shot. Jerian Grant with the assist.,109491,97480,true,true,false,Pat,Jerian,Connaughton,Grant,ND,ND,63,60,6,3,2,,,,,10,2,48,Dunk Shot,3,Field Goal Made,0,0,0,46,46,
2,8,57,Personal foul committed by Jerian Grant.,97480,,true,false,false,Jerian,,Grant,,ND,,63,60,6,4,2,,,,,17,,1,Personal,8,Foul,,,,46,46,
2,8,48,Shooting foul committed by Zach Auguste.,116591,,true,false,false,Zach,,Auguste,,ND,,63,60,6,5,2,,,,,6,,2,Shooting,8,Foul,,,,46,46,
2,8,48,Austin Etherington makes free throw 1 of 2.,109543,,true,false,false,Austin,,Etherington,,Ind,,63,61,6,5,1,,,,,4,1,11,Free Throw 1 of 2,1,Free Throw Made,,,,73,73,
2,8,48,Austin Etherington makes free throw 2 of 2.,109543,,true,false,false,Austin,,Etherington,,Ind,,63,62,6,5,1,,,,,5,1,12,Free Throw 2 of 2,1,Free Throw Made,,,,73,73,
2,8,19,Jerian Grant misses a jump shot from 18 feet out.,97480,,true,false,false,Jerian,,Grant,,ND,,63,62,6,5,2,,,,,17,2,45,Jump Shot,4,Field Goal Missed,18,-16.8,6.9,46,46,
2,8,19,Evan Gordon with a defensive rebound.,88325,,true,false,false,Evan,,Gordon,,Ind,,63,62,6,5,1,,,,,11,,,,6,Defensive Rebound,,,,73,73,
2,7,57,Will Sheehey with a lost ball turnover: Lost Ball,97590,,true,false,false,Will,,Sheehey,,Ind,,63,62,6,5,3,,,,,20,,2,Lost Ball,7,Turnover,,,,73,73,
2,7,53,Shooting foul committed by Austin Etherington.,109543,,true,false,false,Austin,,Etherington,,Ind,,63,62,7,5,2,,,,,5,,2,Shooting,8,Foul,,,,73,73,
2,7,53,Official TV timeout.,,,false,false,false,,,,,,,63,62,7,5,0,,,,,0,,3,Official TV,11,Timeout,,,,46,46,
2,7,53,Jerian Grant makes free throw 1 of 2.,97480,,true,false,false,Jerian,,Grant,,ND,,64,62,7,5,2,,,,,18,1,11,Free Throw 1 of 2,1,Free Throw Made,,,,46,46,
2,7,53,Jerian Grant makes free throw 2 of 2.,97480,,true,false,false,Jerian,,Grant,,ND,,65,62,7,5,2,,,,,19,1,12,Free Throw 2 of 2,1,Free Throw Made,,,,46,46,
2,7,28,Noah Vonleh misses a jump shot from 6 feet out.,121075,,true,false,false,Noah,,Vonleh,,Ind,,65,62,7,5,3,,,,,8,2,45,Jump Shot,4,Field Goal Missed,6,-1.3,5.5,73,73,
2,7,28,Will Sheehey with an offensive rebound.,97590,,true,false,false,Will,,Sheehey,,Ind,,65,62,7,5,3,,,,,20,,,,5,Offensive Rebound,,,,73,73,
2,7,27,Shooting foul committed by Zach Auguste.,116591,,true,false,false,Zach,,Auguste,,ND,,65,62,7,6,3,,,,,6,,2,Shooting,8,Foul,,,,46,46,
2,7,27,Will Sheehey makes free throw 1 of 2.,97590,,true,false,false,Will,,Sheehey,,Ind,,65,63,7,6,3,,,,,21,1,11,Free Throw 1 of 2,1,Free Throw Made,,,,73,73,
2,7,27,Will Sheehey makes free throw 2 of 2.,97590,,true,false,false,Will,,Sheehey,,Ind,,65,64,7,6,3,,,,,22,1,12,Free Throw 2 of 2,1,Free Throw Made,,,,73,73,
2,7,15,Shooting foul committed by Evan Gordon.,88325,,true,false,false,Evan,,Gordon,,Ind,,65,64,8,6,2,,,,,11,,2,Shooting,8,Foul,,,,73,73,
2,7,15,Demetrius Jackson makes free throw 1 of 2.,120755,,true,false,false,Demetrius,,Jackson,,ND,,66,64,8,6,1,,,,,3,1,11,Free Throw 1 of 2,1,Free Throw Made,,,,46,46,
2,7,15,Demetrius Jackson makes free throw 2 of 2.,120755,,true,false,false,Demetrius,,Jackson,,ND,,67,64,8,6,1,,,,,4,1,12,Free Throw 2 of 2,1,Free Throw Made,,,,46,46,
2,6,58,Personal foul committed by Eric Atkins.,97478,,true,false,false,Eric,,Atkins,,ND,,67,64,8,7,2,,,,,5,,1,Personal,8,Foul,,,,46,46,
2,6,58,Noah Vonleh misses free throw 1 of 2.,121075,,true,false,false,Noah,,Vonleh,,Ind,,67,64,8,7,3,,,,,8,1,11,Free Throw 1 of 2,2,Free Throw Missed,,,,73,73,
2,6,58,Jerian Grant with a defensive rebound.,97480,,true,false,false,Jerian,,Grant,,ND,,67,64,8,7,2,,,,,19,,,,6,Defensive Rebound,,,,46,46,
2,6,37,Garrick Sherman misses a jump shot from 19 feet out.,88941,,true,false,false,Garrick,,Sherman,,ND,,67,64,8,7,3,,,,,15,2,45,Jump Shot,4,Field Goal Missed,19,11.3,14.7,46,46,
2,6,37,Will Sheehey with a defensive rebound.,97590,,true,false,false,Will,,Sheehey,,Ind,,67,64,8,7,3,,,,,22,,,,6,Defensive Rebound,,,,73,73,
2,6,12,Evan Gordon misses a 3-point jump shot from 25 feet out.,88325,,true,false,false,Evan,,Gordon,,Ind,,67,64,8,7,2,,,,,11,3,45,Jump Shot,4,Field Goal Missed,25,14.9,20.3,73,73,
2,6,12,Pat Connaughton with a defensive rebound.,109491,,true,false,false,Pat,,Connaughton,,ND,,67,64,8,7,2,,,,,10,,,,6,Defensive Rebound,,,,46,46,
2,6,07,ND take a full timeout.,,,false,false,false,,,,,,,67,64,8,7,0,,,,,0,,1,Regular,11,Timeout,,,,46,46,
2,5,42,Jerian Grant misses a 3-point jump shot from 25 feet out.,97480,,true,false,false,Jerian,,Grant,,ND,,67,64,8,7,2,,,,,19,3,45,Jump Shot,4,Field Goal Missed,25,15,20,46,46,
2,5,42,Stanford Robinson with a defensive rebound.,121080,,true,false,false,Stanford,,Robinson,,Ind,,67,64,8,7,1,,,,,4,,,,6,Defensive Rebound,,,,73,73,
2,5,28,Shooting foul committed by Will Sheehey.,97590,,true,false,false,Will,,Sheehey,,Ind,,67,64,9,7,4,,,,,22,,2,Shooting,8,Foul,,,,73,73,
2,5,28,Demetrius Jackson makes free throw 1 of 2.,120755,,true,false,false,Demetrius,,Jackson,,ND,,68,64,9,7,1,,,,,5,1,11,Free Throw 1 of 2,1,Free Throw Made,,,,46,46,
2,5,28,Demetrius Jackson misses free throw 2 of 2.,120755,,true,false,false,Demetrius,,Jackson,,ND,,68,64,9,7,1,,,,,5,1,12,Free Throw 2 of 2,2,Free Throw Missed,,,,46,46,
2,5,28,Stanford Robinson with a defensive rebound.,121080,,true,false,false,Stanford,,Robinson,,Ind,,68,64,9,7,1,,,,,4,,,,6,Defensive Rebound,,,,73,73,
2,5,14,Stanford Robinson makes a jump shot from 6 feet out.,121080,,true,false,false,Stanford,,Robinson,,Ind,,68,66,9,7,1,,,,,6,2,45,Jump Shot,3,Field Goal Made,6,2.5,5.5,73,73,
2,4,56,Pat Connaughton makes a 3-point jump shot from 23 feet out. Jerian Grant with the assist.,109491,97480,true,true,false,Pat,Jerian,Connaughton,Grant,ND,ND,71,66,9,7,2,,,,,13,3,45,Jump Shot,3,Field Goal Made,23,-22.7,-.9,46,46,
2,4,29,Will Sheehey with a bad pass turnover: Bad Pass,97590,,true,false,false,Will,,Sheehey,,Ind,,71,66,9,7,4,,,,,22,,1,Bad Pass,7,Turnover,,,,73,73,
2,4,18,Eric Atkins with a lost ball turnover: Lost Ball,97478,,true,false,false,Eric,,Atkins,,ND,,71,66,9,7,2,,,,,5,,2,Lost Ball,7,Turnover,,,,46,46,
2,4,09,Offensive foul committed by Evan Gordon.,88325,,true,false,false,Evan,,Gordon,,Ind,,71,66,10,7,3,,,,,11,,4,Offensive,8,Foul,,,,73,73,
2,4,09,Evan Gordon with a  turnover:,88325,,true,false,false,Evan,,Gordon,,Ind,,71,66,10,7,3,,,,,11,,,,7,Turnover,,,,73,73,
2,3,44,Eric Atkins with a lost ball turnover: Lost Ball,97478,,true,false,false,Eric,,Atkins,,ND,,71,66,10,7,2,,,,,5,,2,Lost Ball,7,Turnover,,,,46,46,
2,3,21,Yogi Ferrell misses a jump shot from 10 feet out.,116724,,true,false,false,Yogi,,Ferrell,,Ind,,71,66,10,7,0,,,,,7,2,45,Jump Shot,4,Field Goal Missed,10,-10,3,73,73,
2,3,21,Jerian Grant with a defensive rebound.,97480,,true,false,false,Jerian,,Grant,,ND,,71,66,10,7,2,,,,,19,,,,6,Defensive Rebound,,,,46,46,
2,2,55,Jerian Grant with a lost ball turnover: Lost Ball,97480,,true,false,false,Jerian,,Grant,,ND,,71,66,10,7,2,,,,,19,,2,Lost Ball,7,Turnover,,,,46,46,
2,2,55,Ind take a 20-second timeout.,,,false,false,false,,,,,,,71,66,10,7,0,,,,,0,,2,Short,11,Timeout,,,,73,73,
2,2,43,Yogi Ferrell makes a 3-point jump shot from 25 feet out.,116724,,true,false,false,Yogi,,Ferrell,,Ind,,71,69,10,7,0,,,,,10,3,45,Jump Shot,3,Field Goal Made,25,-13.9,20.5,73,73,
2,2,27,ND take a full timeout.,,,false,false,false,,,,,,,71,69,10,7,0,,,,,0,,1,Regular,11,Timeout,,,,46,46,
2,2,10,Official TV timeout.,,,false,false,false,,,,,,,71,69,10,7,0,,,,,0,,3,Official TV,11,Timeout,,,,46,46,
2,2,04,Garrick Sherman with a lost ball turnover: Lost Ball,88941,,true,false,false,Garrick,,Sherman,,ND,,71,69,10,7,3,,,,,15,,2,Lost Ball,7,Turnover,,,,46,46,
2,1,47,Yogi Ferrell misses a jump shot from 6 feet out.,116724,,true,false,false,Yogi,,Ferrell,,Ind,,71,69,10,7,0,,,,,10,2,45,Jump Shot,4,Field Goal Missed,6,-3,5,73,73,
2,1,47,Eric Atkins with a defensive rebound.,97478,,true,false,false,Eric,,Atkins,,ND,,71,69,10,7,2,,,,,5,,,,6,Defensive Rebound,,,,46,46,
2,1,21,Eric Atkins makes a layup shot. Jerian Grant with the assist.,97478,97480,true,true,false,Eric,Jerian,Atkins,Grant,ND,ND,73,69,10,7,2,,,,,7,2,40,Layup Shot,3,Field Goal Made,0,0,0,46,46,
2,1,08,Yogi Ferrell misses a 3-point jump shot from 23 feet out.,116724,,true,false,false,Yogi,,Ferrell,,Ind,,73,69,10,7,0,,,,,10,3,45,Jump Shot,4,Field Goal Missed,23,-9.8,21,73,73,
2,1,08,Pat Connaughton with a defensive rebound.,109491,,true,false,false,Pat,,Connaughton,,ND,,73,69,10,7,2,,,,,13,,,,6,Defensive Rebound,,,,46,46,
2,0,41.8,Eric Atkins with a lost ball turnover: Lost Ball,97478,,true,false,false,Eric,,Atkins,,ND,,73,69,10,7,2,,,,,7,,2,Lost Ball,7,Turnover,,,,46,46,
2,0,36.6,Will Sheehey misses a 3-point jump shot from 23 feet out.,97590,,true,false,false,Will,,Sheehey,,Ind,,73,69,10,7,4,,,,,22,3,45,Jump Shot,4,Field Goal Missed,23,-9.4,21.5,73,73,
2,0,36.6,ND with a defensive rebound.,,,false,false,false,,,,,,,73,69,10,7,0,,,,,0,,,,6,Defensive Rebound,,,,46,46,
2,0,36.6,Personal foul committed by Noah Vonleh.,121075,,true,false,false,Noah,,Vonleh,,Ind,,73,69,11,7,4,,,,,8,,1,Personal,8,Foul,,,,73,73,
2,0,36.6,Pat Connaughton misses free throw 1 of 2.,109491,,true,false,false,Pat,,Connaughton,,ND,,73,69,11,7,2,,,,,13,1,11,Free Throw 1 of 2,2,Free Throw Missed,,,,46,46,
2,0,36.6,ND with an offensive rebound.,,,false,false,false,,,,,,,73,69,11,7,0,,,,,0,,,,5,Offensive Rebound,,,,46,46,
2,0,36.6,Pat Connaughton makes free throw 2 of 2.,109491,,true,false,false,Pat,,Connaughton,,ND,,74,69,11,7,2,,,,,14,1,12,Free Throw 2 of 2,1,Free Throw Made,,,,46,46,
2,0,30.2,Personal foul committed by Eric Atkins.,97478,,true,false,false,Eric,,Atkins,,ND,,74,69,11,8,3,,,,,7,,1,Personal,8,Foul,,,,46,46,
2,0,30.2,Yogi Ferrell misses free throw 1 of 2.,116724,,true,false,false,Yogi,,Ferrell,,Ind,,74,69,11,8,0,,,,,10,1,11,Free Throw 1 of 2,2,Free Throw Missed,,,,73,73,
2,0,30.2,Garrick Sherman with a defensive rebound.,88941,,true,false,false,Garrick,,Sherman,,ND,,74,69,11,8,3,,,,,15,,,,6,Defensive Rebound,,,,46,46,
2,0,27.0,Personal foul committed by Will Sheehey.,97590,,true,false,false,Will,,Sheehey,,Ind,,74,69,12,8,5,,,,,22,,1,Personal,8,Foul,,,,73,73,
2,0,27.0,Garrick Sherman misses free throw 1 of 2.,88941,,true,false,false,Garrick,,Sherman,,ND,,74,69,12,8,3,,,,,15,1,11,Free Throw 1 of 2,2,Free Throw Missed,,,,46,46,
2,0,27.0,ND with an offensive rebound.,,,false,false,false,,,,,,,74,69,12,8,0,,,,,0,,,,5,Offensive Rebound,,,,46,46,
2,0,27.0,Garrick Sherman makes free throw 2 of 2.,88941,,true,false,false,Garrick,,Sherman,,ND,,75,69,12,8,3,,,,,16,1,12,Free Throw 2 of 2,1,Free Throw Made,,,,46,46,
2,0,15.6,Yogi Ferrell misses a jump shot from 12 feet out.,116724,,true,false,false,Yogi,,Ferrell,,Ind,,75,69,12,8,0,,,,,10,2,45,Jump Shot,4,Field Goal Missed,12,2.5,11.3,73,73,
2,0,15.6,Eric Atkins with a defensive rebound.,97478,,true,false,false,Eric,,Atkins,,ND,,75,69,12,8,3,,,,,7,,,,6,Defensive Rebound,,,,46,46,
2,0,13.6,Ind take a full timeout.,,,false,false,false,,,,,,,75,69,12,8,0,,,,,0,,1,Regular,11,Timeout,,,,73,73,
2,0,11.5,Personal foul committed by Yogi Ferrell.,116724,,true,false,false,Yogi,,Ferrell,,Ind,,75,69,13,8,1,,,,,10,,1,Personal,8,Foul,,,,73,73,
2,0,11.5,Jerian Grant makes free throw 1 of 2.,97480,,true,false,false,Jerian,,Grant,,ND,,76,69,13,8,2,,,,,20,1,11,Free Throw 1 of 2,1,Free Throw Made,,,,46,46,
2,0,11.5,Jerian Grant makes free throw 2 of 2.,97480,,true,false,false,Jerian,,Grant,,ND,,77,69,13,8,2,,,,,21,1,12,Free Throw 2 of 2,1,Free Throw Made,,,,46,46,
2,0,05.3,Yogi Ferrell makes a 3-point jump shot from 25 feet out.,116724,,true,false,false,Yogi,,Ferrell,,Ind,,77,72,13,8,1,,,,,13,3,45,Jump Shot,3,Field Goal Made,25,-16.8,19,73,73,
2,0,05.3,Ind take a full timeout.,,,false,false,false,,,,,,,77,72,13,8,0,,,,,0,,1,Regular,11,Timeout,,,,73,73,
2,0,04.1,Jerian Grant makes a layup shot. Pat Connaughton with the assist.,97480,109491,true,true,false,Jerian,Pat,Grant,Connaughton,ND,ND,79,72,13,8,2,,,,,23,2,40,Layup Shot,3,Field Goal Made,0,0,0,46,46,
2,0,00,Evan Gordon misses a 3-point jump shot from 25 feet out.,88325,,true,false,false,Evan,,Gordon,,Ind,,79,72,13,8,3,,,,,11,3,45,Jump Shot,4,Field Goal Missed,25,-10,23,73,73,
2,0,00,ND with a defensive rebound.,,,false,false,false,,,,,,,79,72,13,8,0,,,,,0,,,,6,Defensive Rebound,,,,46,46,
2,0,00,End of the 2nd Half,,,false,false,false,,,,,,,79,72,13,8,0,,,,,0,,,,15,End Period,,,,46,46,
2,0,00,End of the Game,,,false,false,false,,,,,,,79,72,13,8,0,,,,,0,,,,19,Game Over,,,,46,46,
