half,time-minutes,time-seconds,details,player1-id,player2-id,player1-linkable,player2-linkable,player3-linkable,player-first-name-1,player-first-name-2,player-last-name-1,player-last-name-2,player-team-alias-1,player-team-alias-2,home-score,visitor-score,visitor-fouls,home-fouls,player-fouls,fastbreak,in-paint,second-chance,off-turnover,player-score,points-type,detail-id,detail-desc,event-id,event-desc,distance,x-coord,y-coord,team-id-1,team-id-2,team-id-3
2,0,03.5,UNC take a full timeout.,,,false,false,false,,,,,,,62,59,9,5,0,,,,,0,,1,Regular,11,Timeout,,,,15,15,
2,0,02.4,Shooting foul committed by J.P. Tokoto.,116589,,true,false,false,J.P.,,Tokoto,,UNC,,62,59,10,5,3,,,,,16,,2,Shooting,8,Foul,,,,15,15,
2,0,02.4,Robert Williams misses free throw 1 of 2.,88732,,true,false,false,Robert,,Williams,,UAB,,62,59,10,5,2,,,,,1,1,11,Free Throw 1 of 2,2,Free Throw Missed,,,,128,128,
2,0,02.4,UAB with an offensive rebound.,,,false,false,false,,,,,,,62,59,10,5,0,,,,,0,,,,5,Offensive Rebound,,,,128,128,
2,0,02.4,Robert Williams makes free throw 2 of 2.,88732,,true,false,false,Robert,,Williams,,UAB,,63,59,10,5,2,,,,,2,1,12,Free Throw 2 of 2,1,Free Throw Made,,,,128,128,
2,0,01.4,UNC take a full timeout.,,,false,false,false,,,,,,,63,59,10,5,0,,,,,0,,1,Regular,11,Timeout,,,,15,15,
2,0,00.5,James Michael McAdoo misses a 3-point jump shot from 23 feet out.,110437,,true,false,false,James Michael,,McAdoo,,UNC,,63,59,10,5,3,,,,,6,3,45,Jump Shot,4,Field Goal Missed,23,-15.7,17.4,15,15,
2,0,00.5,UNC with an offensive rebound.,,,false,false,false,,,,,,,63,59,10,5,0,,,,,0,,,,5,Offensive Rebound,,,,15,15,
2,0,00,End of the 2nd Half,,,false,false,false,,,,,,,63,59,10,5,0,,,,,0,,,,15,End Period,,,,128,128,
2,0,00,End of the Game,,,false,false,false,,,,,,,63,59,10,5,0,,,,,0,,,,19,Game Over,,,,128,128,
