half,time-minutes,time-seconds,details,player1-id,player2-id,player1-linkable,player2-linkable,player3-linkable,player-first-name-1,player-first-name-2,player-last-name-1,player-last-name-2,player-team-alias-1,player-team-alias-2,home-score,visitor-score,visitor-fouls,home-fouls,player-fouls,fastbreak,in-paint,second-chance,off-turnover,player-score,points-type,detail-id,detail-desc,event-id,event-desc,distance,x-coord,y-coord,team-id-1,team-id-2,team-id-3
1,20,00,Start of the 1st Half,,,false,false,false,,,,,,,0,0,0,0,0,,,,,0,,,,14,Start Period,,,,42,42,
1,19,32,Talib Zanna misses a jump shot from 15 feet out.,88283,,true,false,false,Talib,,Zanna,,Pitt,,0,0,0,0,0,,,,,0,2,45,Jump Shot,4,Field Goal Missed,15,7.9,12.7,47,47,
1,19,32,Cameron Wright with an offensive rebound.,97236,,true,false,false,Cameron,,Wright,,Pitt,,0,0,0,0,0,,,,,0,,,,5,Offensive Rebound,,,,47,47,
1,19,26,Cameron Wright makes a layup shot.,97236,,true,false,false,Cameron,,Wright,,Pitt,,0,2,0,0,0,,,,,2,2,40,Layup Shot,3,Field Goal Made,0,0,0,47,47,
1,19,08,Ryan Anderson with a traveling turnover: Traveling,110082,,true,false,false,Ryan,,Anderson,,BC,,0,2,0,0,0,,,,,0,,4,Traveling,7,Turnover,,,,42,42,
1,18,40,Michael Young misses a dunk shot.,120761,,true,false,false,Michael,,Young,,Pitt,,0,2,0,0,0,,,,,0,2,48,Dunk Shot,4,Field Goal Missed,0,0,0,47,47,
1,18,40,Olivier Hanlan with a defensive rebound.,116003,,true,false,false,Olivier,,Hanlan,,BC,,0,2,0,0,0,,,,,0,,,,6,Defensive Rebound,,,,42,42,
1,18,34,Patrick Heckmann makes a layup shot.,110086,,true,false,false,Patrick,,Heckmann,,BC,,2,2,0,0,0,,,,,2,2,40,Layup Shot,3,Field Goal Made,0,0,0,42,42,
1,18,24,Cameron Wright with a lost ball turnover: Lost Ball,97236,,true,false,false,Cameron,,Wright,,Pitt,,2,2,0,0,0,,,,,2,,2,Lost Ball,7,Turnover,,,,47,47,
1,18,21,Shooting foul committed by James Robinson.,116087,,true,false,false,James,,Robinson,,Pitt,,2,2,1,0,1,,,,,0,,2,Shooting,8,Foul,,,,47,47,
1,18,21,Olivier Hanlan misses free throw 1 of 2.,116003,,true,false,false,Olivier,,Hanlan,,BC,,2,2,1,0,0,,,,,0,1,11,Free Throw 1 of 2,2,Free Throw Missed,,,,42,42,
1,18,21,BC with an offensive rebound.,,,false,false,false,,,,,,,2,2,1,0,0,,,,,0,,,,5,Offensive Rebound,,,,42,42,
1,18,21,Olivier Hanlan makes free throw 2 of 2.,116003,,true,false,false,Olivier,,Hanlan,,BC,,3,2,1,0,0,,,,,1,1,12,Free Throw 2 of 2,1,Free Throw Made,,,,42,42,
1,18,06,Lamar Patterson with a lost ball turnover: Lost Ball,88282,,true,false,false,Lamar,,Patterson,,Pitt,,3,2,1,0,0,,,,,0,,2,Lost Ball,7,Turnover,,,,47,47,
1,18,03,Olivier Hanlan makes a dunk shot.,116003,,true,false,false,Olivier,,Hanlan,,BC,,5,2,1,0,0,,,,,3,2,48,Dunk Shot,3,Field Goal Made,0,0,0,42,42,
1,17,49,Cameron Wright with a lost ball turnover: Lost Ball,97236,,true,false,false,Cameron,,Wright,,Pitt,,5,2,1,0,0,,,,,2,,2,Lost Ball,7,Turnover,,,,47,47,
1,17,45,Patrick Heckmann makes a dunk shot.,110086,,true,false,false,Patrick,,Heckmann,,BC,,7,2,1,0,0,,,,,4,2,48,Dunk Shot,3,Field Goal Made,0,0,0,42,42,
1,17,44,Pitt take a 20-second timeout.,,,false,false,false,,,,,,,7,2,1,0,0,,,,,0,,2,Short,11,Timeout,,,,47,47,
1,17,16,Michael Young misses a jump shot from 14 feet out.,120761,,true,false,false,Michael,,Young,,Pitt,,7,2,1,0,0,,,,,0,2,45,Jump Shot,4,Field Goal Missed,14,.8,14.4,47,47,
1,17,16,Talib Zanna with an offensive rebound.,88283,,true,false,false,Talib,,Zanna,,Pitt,,7,2,1,0,0,,,,,0,,,,5,Offensive Rebound,,,,47,47,
1,17,13,Talib Zanna makes a tip shot from 4 feet out.,88283,,true,false,false,Talib,,Zanna,,Pitt,,7,4,1,0,0,,,,,2,2,53,Tip Shot,3,Field Goal Made,4,-.3,3.6,47,47,
1,16,51,Ryan Anderson with a lost ball turnover: Lost Ball,110082,,true,false,false,Ryan,,Anderson,,BC,,7,4,1,0,0,,,,,0,,2,Lost Ball,7,Turnover,,,,42,42,
1,16,30,Cameron Wright makes a layup shot. James Robinson with the assist.,97236,116087,true,true,false,Cameron,James,Wright,Robinson,Pitt,Pitt,7,6,1,0,0,,,,,4,2,40,Layup Shot,3,Field Goal Made,0,0,0,47,47,
1,16,17,Will Magarity misses a 3-point jump shot from 23 feet out.,122015,,true,false,false,Will,,Magarity,,BC,,7,6,1,0,0,,,,,0,3,45,Jump Shot,4,Field Goal Missed,23,17.4,15.6,42,42,
1,16,17,James Robinson with a defensive rebound.,116087,,true,false,false,James,,Robinson,,Pitt,,7,6,1,0,1,,,,,0,,,,6,Defensive Rebound,,,,47,47,
1,15,57,Lamar Patterson makes a 3-point jump shot from 23 feet out. Talib Zanna with the assist.,88282,88283,true,true,false,Lamar,Talib,Patterson,Zanna,Pitt,Pitt,7,9,1,0,0,,,,,3,3,45,Jump Shot,3,Field Goal Made,23,22.9,.6,47,47,
1,15,30,Personal foul committed by Talib Zanna.,88283,,true,false,false,Talib,,Zanna,,Pitt,,7,9,2,0,1,,,,,2,,1,Personal,8,Foul,,,,47,47,
1,15,30,Official TV timeout.,,,false,false,false,,,,,,,7,9,2,0,0,,,,,0,,3,Official TV,11,Timeout,,,,42,42,
1,15,28,Shooting foul committed by Derrick Randall.,110181,,true,false,false,Derrick,,Randall,,Pitt,,7,9,3,0,1,,,,,0,,2,Shooting,8,Foul,,,,47,47,
1,15,28,Ryan Anderson makes free throw 1 of 2.,110082,,true,false,false,Ryan,,Anderson,,BC,,8,9,3,0,0,,,,,1,1,11,Free Throw 1 of 2,1,Free Throw Made,,,,42,42,
1,15,28,Ryan Anderson makes free throw 2 of 2.,110082,,true,false,false,Ryan,,Anderson,,BC,,9,9,3,0,0,,,,,2,1,12,Free Throw 2 of 2,1,Free Throw Made,,,,42,42,
1,14,53,Cameron Wright makes a jump shot from 21 feet out. Lamar Patterson with the assist.,97236,88282,true,true,false,Cameron,Lamar,Wright,Patterson,Pitt,Pitt,9,11,3,0,0,,,,,6,2,45,Jump Shot,3,Field Goal Made,21,-7.7,19.1,47,47,
1,14,29,Garland Owens makes a layup shot. Olivier Hanlan with the assist.,120748,116003,true,true,false,Garland,Olivier,Owens,Hanlan,BC,BC,11,11,3,0,0,,,,,2,2,40,Layup Shot,3,Field Goal Made,0,0,0,42,42,
1,13,58,Jamel Artis makes a 3-point jump shot from 22 feet out. Cameron Wright with the assist.,120758,97236,true,true,false,Jamel,Cameron,Artis,Wright,Pitt,Pitt,11,14,3,0,0,,,,,3,3,45,Jump Shot,3,Field Goal Made,22,20.8,8.2,47,47,
1,13,37,Garland Owens with a lost ball turnover: Lost Ball,120748,,true,false,false,Garland,,Owens,,BC,,11,14,3,0,0,,,,,2,,2,Lost Ball,7,Turnover,,,,42,42,
1,13,27,Josh Newkirk misses a 3-point jump shot from 24 feet out.,120759,,true,false,false,Josh,,Newkirk,,Pitt,,11,14,3,0,0,,,,,0,3,45,Jump Shot,4,Field Goal Missed,24,.1,23.7,47,47,
1,13,27,Cameron Wright with an offensive rebound.,97236,,true,false,false,Cameron,,Wright,,Pitt,,11,14,3,0,0,,,,,6,,,,5,Offensive Rebound,,,,47,47,
1,13,19,Lamar Patterson makes a layup shot.,88282,,true,false,false,Lamar,,Patterson,,Pitt,,11,16,3,0,0,,,,,5,2,40,Layup Shot,3,Field Goal Made,0,0,0,47,47,
1,12,56,Eddie Odio misses a 3-point jump shot from 23 feet out.,110078,,true,false,false,Eddie,,Odio,,BC,,11,16,3,0,0,,,,,0,3,45,Jump Shot,4,Field Goal Missed,23,-11,20,42,42,
1,12,56,Lonnie Jackson with an offensive rebound.,110084,,true,false,false,Lonnie,,Jackson,,BC,,11,16,3,0,0,,,,,0,,,,5,Offensive Rebound,,,,42,42,
1,12,50,Olivier Hanlan misses a 3-point jump shot from 23 feet out.,116003,,true,false,false,Olivier,,Hanlan,,BC,,11,16,3,0,0,,,,,3,3,45,Jump Shot,4,Field Goal Missed,23,-13.5,18.1,42,42,
1,12,50,Josh Newkirk with a defensive rebound.,120759,,true,false,false,Josh,,Newkirk,,Pitt,,11,16,3,0,0,,,,,0,,,,6,Defensive Rebound,,,,47,47,
1,12,26,Lamar Patterson makes a 3-point jump shot from 23 feet out. Josh Newkirk with the assist.,88282,120759,true,true,false,Lamar,Josh,Patterson,Newkirk,Pitt,Pitt,11,19,3,0,0,,,,,8,3,45,Jump Shot,3,Field Goal Made,23,18.1,14.4,47,47,
1,12,25,BC take a 20-second timeout.,,,false,false,false,,,,,,,11,19,3,0,0,,,,,0,,2,Short,11,Timeout,,,,42,42,
1,12,04,Ryan Anderson misses a layup shot.,110082,,true,false,false,Ryan,,Anderson,,BC,,11,19,3,0,0,,,,,2,2,40,Layup Shot,4,Field Goal Missed,0,0,0,42,42,
1,12,04,Josh Newkirk with a defensive rebound.,120759,,true,false,false,Josh,,Newkirk,,Pitt,,11,19,3,0,0,,,,,0,,,,6,Defensive Rebound,,,,47,47,
1,12,01,Jamel Artis makes a layup shot. Josh Newkirk with the assist.,120758,120759,true,true,false,Jamel,Josh,Artis,Newkirk,Pitt,Pitt,11,21,3,0,0,,,,,5,2,40,Layup Shot,3,Field Goal Made,0,0,0,47,47,
1,11,42,Lonnie Jackson misses a 3-point jump shot from 22 feet out.,110084,,true,false,false,Lonnie,,Jackson,,BC,,11,21,3,0,0,,,,,0,3,45,Jump Shot,4,Field Goal Missed,22,21.5,3.5,42,42,
1,11,42,Jamel Artis with a defensive rebound.,120758,,true,false,false,Jamel,,Artis,,Pitt,,11,21,3,0,0,,,,,5,,,,6,Defensive Rebound,,,,47,47,
1,11,32,Josh Newkirk misses a layup shot.,120759,,true,false,false,Josh,,Newkirk,,Pitt,,11,21,3,0,0,,,,,0,2,40,Layup Shot,4,Field Goal Missed,0,0,0,47,47,
1,11,32,Lamar Patterson with an offensive rebound.,88282,,true,false,false,Lamar,,Patterson,,Pitt,,11,21,3,0,0,,,,,8,,,,5,Offensive Rebound,,,,47,47,
1,11,32,Lamar Patterson with a lost ball turnover: Lost Ball,88282,,true,false,false,Lamar,,Patterson,,Pitt,,11,21,3,0,0,,,,,8,,2,Lost Ball,7,Turnover,,,,47,47,
1,11,21,Olivier Hanlan misses a layup shot.,116003,,true,false,false,Olivier,,Hanlan,,BC,,11,21,3,0,0,,,,,3,2,40,Layup Shot,4,Field Goal Missed,0,0,0,42,42,
1,11,21,Garland Owens with an offensive rebound.,120748,,true,false,false,Garland,,Owens,,BC,,11,21,3,0,0,,,,,2,,,,5,Offensive Rebound,,,,42,42,
1,11,18,Garland Owens misses a tip shot from 4 feet out.,120748,,true,false,false,Garland,,Owens,,BC,,11,21,3,0,0,,,,,2,2,53,Tip Shot,4,Field Goal Missed,4,1,4,42,42,
1,11,18,James Robinson with a defensive rebound.,116087,,true,false,false,James,,Robinson,,Pitt,,11,21,3,0,1,,,,,0,,,,6,Defensive Rebound,,,,47,47,
1,11,13,Lamar Patterson misses a jump shot from 17 feet out.,88282,,true,false,false,Lamar,,Patterson,,Pitt,,11,21,3,0,0,,,,,8,2,45,Jump Shot,4,Field Goal Missed,17,-7.7,15.4,47,47,
1,11,13,Derrick Randall with an offensive rebound.,110181,,true,false,false,Derrick,,Randall,,Pitt,,11,21,3,0,1,,,,,0,,,,5,Offensive Rebound,,,,47,47,
1,11,10,Derrick Randall makes a layup shot.,110181,,true,false,false,Derrick,,Randall,,Pitt,,11,23,3,0,1,,,,,2,2,40,Layup Shot,3,Field Goal Made,0,0,0,47,47,
1,10,52,Garland Owens makes a layup shot. Olivier Hanlan with the assist.,120748,116003,true,true,false,Garland,Olivier,Owens,Hanlan,BC,BC,13,23,3,0,0,,,,,4,2,40,Layup Shot,3,Field Goal Made,0,0,0,42,42,
1,10,24,Personal foul committed by Garland Owens.,120748,,true,false,false,Garland,,Owens,,BC,,13,23,3,1,1,,,,,4,,1,Personal,8,Foul,,,,42,42,
1,10,24,Official TV timeout.,,,false,false,false,,,,,,,13,23,3,1,0,,,,,0,,3,Official TV,11,Timeout,,,,42,42,
1,10,10,Chris Jones with a lost ball turnover: Lost Ball,116086,,true,false,false,Chris,,Jones,,Pitt,,13,23,3,1,0,,,,,0,,2,Lost Ball,7,Turnover,,,,47,47,
1,10,06,Olivier Hanlan makes a layup shot. Ryan Anderson with the assist.,116003,110082,true,true,false,Olivier,Ryan,Hanlan,Anderson,BC,BC,15,23,3,1,0,,,,,5,2,40,Layup Shot,3,Field Goal Made,0,0,0,42,42,
1,9,37,Michael Young misses a jump shot from 21 feet out.,120761,,true,false,false,Michael,,Young,,Pitt,,15,23,3,1,0,,,,,0,2,45,Jump Shot,4,Field Goal Missed,21,15.2,13.9,47,47,
1,9,37,Patrick Heckmann with a defensive rebound.,110086,,true,false,false,Patrick,,Heckmann,,BC,,15,23,3,1,0,,,,,4,,,,6,Defensive Rebound,,,,42,42,
1,9,23,Olivier Hanlan misses a 3-point jump shot from 23 feet out.,116003,,true,false,false,Olivier,,Hanlan,,BC,,15,23,3,1,0,,,,,5,3,45,Jump Shot,4,Field Goal Missed,23,18.6,14.2,42,42,
1,9,23,James Robinson with a defensive rebound.,116087,,true,false,false,James,,Robinson,,Pitt,,15,23,3,1,1,,,,,0,,,,6,Defensive Rebound,,,,47,47,
1,9,16,Shooting foul committed by Ryan Anderson.,110082,,true,false,false,Ryan,,Anderson,,BC,,15,23,3,2,1,,,,,2,,2,Shooting,8,Foul,,,,42,42,
1,8,49,Talib Zanna makes a layup shot. Lamar Patterson with the assist.,88283,88282,true,true,false,Talib,Lamar,Zanna,Patterson,Pitt,Pitt,15,25,3,2,1,,,,,4,2,40,Layup Shot,3,Field Goal Made,0,0,0,47,47,
1,8,49,Shooting foul committed by Patrick Heckmann.,110086,,true,false,false,Patrick,,Heckmann,,BC,,15,25,3,3,1,,,,,4,,2,Shooting,8,Foul,,,,42,42,
1,8,49,Talib Zanna makes free throw 1 of 1.,88283,,true,false,false,Talib,,Zanna,,Pitt,,15,26,3,3,1,,,,,5,1,10,Free Throw 1 of 1,1,Free Throw Made,,,,47,47,
1,8,24,Personal foul committed by Cameron Wright.,97236,,true,false,false,Cameron,,Wright,,Pitt,,15,26,4,3,1,,,,,6,,1,Personal,8,Foul,,,,47,47,
1,8,03,Patrick Heckmann with a traveling turnover: Traveling,110086,,true,false,false,Patrick,,Heckmann,,BC,,15,26,4,3,1,,,,,4,,4,Traveling,7,Turnover,,,,42,42,
1,7,33,Cameron Wright misses a jump shot from 17 feet out.,97236,,true,false,false,Cameron,,Wright,,Pitt,,15,26,4,3,1,,,,,6,2,45,Jump Shot,4,Field Goal Missed,17,14.4,8.6,47,47,
1,7,33,Patrick Heckmann with a defensive rebound.,110086,,true,false,false,Patrick,,Heckmann,,BC,,15,26,4,3,1,,,,,4,,,,6,Defensive Rebound,,,,42,42,
1,7,16,Lonnie Jackson with a lost ball turnover: Lost Ball,110084,,true,false,false,Lonnie,,Jackson,,BC,,15,26,4,3,0,,,,,0,,2,Lost Ball,7,Turnover,,,,42,42,
1,7,10,Cameron Wright makes a layup shot.,97236,,true,false,false,Cameron,,Wright,,Pitt,,15,28,4,3,1,,,,,8,2,40,Layup Shot,3,Field Goal Made,0,0,0,47,47,
1,6,36,Personal foul committed by Lamar Patterson.,88282,,true,false,false,Lamar,,Patterson,,Pitt,,15,28,5,3,1,,,,,8,,1,Personal,8,Foul,,,,47,47,
1,6,36,Official TV timeout.,,,false,false,false,,,,,,,15,28,5,3,0,,,,,0,,3,Official TV,11,Timeout,,,,42,42,
1,6,26,Garland Owens misses a layup shot.,120748,,true,false,false,Garland,,Owens,,BC,,15,28,5,3,1,,,,,4,2,40,Layup Shot,4,Field Goal Missed,0,0,0,42,42,
1,6,26,Derrick Randall with a defensive rebound.,110181,,true,false,false,Derrick,,Randall,,Pitt,,15,28,5,3,1,,,,,2,,,,6,Defensive Rebound,,,,47,47,
1,6,03,Offensive foul committed by Jamel Artis.,120758,,true,false,false,Jamel,,Artis,,Pitt,,15,28,6,3,1,,,,,5,,4,Offensive,8,Foul,,,,47,47,
1,6,03,Jamel Artis with a  turnover:,120758,,true,false,false,Jamel,,Artis,,Pitt,,15,28,6,3,1,,,,,5,,,,7,Turnover,,,,47,47,
1,5,47,Ryan Anderson misses a jump shot from 15 feet out.,110082,,true,false,false,Ryan,,Anderson,,BC,,15,28,6,3,1,,,,,2,2,45,Jump Shot,4,Field Goal Missed,15,-15.1,2.8,42,42,
1,5,47,Derrick Randall with a defensive rebound.,110181,,true,false,false,Derrick,,Randall,,Pitt,,15,28,6,3,1,,,,,2,,,,6,Defensive Rebound,,,,47,47,
1,5,24,Jamel Artis misses a layup shot.,120758,,true,false,false,Jamel,,Artis,,Pitt,,15,28,6,3,1,,,,,5,2,40,Layup Shot,4,Field Goal Missed,0,0,0,47,47,
1,5,24,Jamel Artis with an offensive rebound.,120758,,true,false,false,Jamel,,Artis,,Pitt,,15,28,6,3,1,,,,,5,,,,5,Offensive Rebound,,,,47,47,
1,5,24,Shooting foul committed by Patrick Heckmann.,110086,,true,false,false,Patrick,,Heckmann,,BC,,15,28,6,4,2,,,,,4,,2,Shooting,8,Foul,,,,42,42,
1,5,24,Jamel Artis makes free throw 1 of 2.,120758,,true,false,false,Jamel,,Artis,,Pitt,,15,29,6,4,1,,,,,6,1,11,Free Throw 1 of 2,1,Free Throw Made,,,,47,47,
1,5,24,Jamel Artis makes free throw 2 of 2.,120758,,true,false,false,Jamel,,Artis,,Pitt,,15,30,6,4,1,,,,,7,1,12,Free Throw 2 of 2,1,Free Throw Made,,,,47,47,
1,4,50,Eddie Odio misses a layup shot.,110078,,true,false,false,Eddie,,Odio,,BC,,15,30,6,4,0,,,,,0,2,40,Layup Shot,4,Field Goal Missed,0,0,0,42,42,
1,4,50,Pitt with a defensive rebound.,,,false,false,false,,,,,,,15,30,6,4,0,,,,,0,,,,6,Defensive Rebound,,,,47,47,
1,4,35,Talib Zanna with a lost ball turnover: Lost Ball,88283,,true,false,false,Talib,,Zanna,,Pitt,,15,30,6,4,1,,,,,5,,2,Lost Ball,7,Turnover,,,,47,47,
1,4,30,Olivier Hanlan makes a layup shot.,116003,,true,false,false,Olivier,,Hanlan,,BC,,17,30,6,4,0,,,,,7,2,40,Layup Shot,3,Field Goal Made,0,0,0,42,42,
1,4,06,Jamel Artis misses a jump shot from 16 feet out.,120758,,true,false,false,Jamel,,Artis,,Pitt,,17,30,6,4,1,,,,,7,2,45,Jump Shot,4,Field Goal Missed,16,15.2,4.7,47,47,
1,4,06,Garland Owens with a defensive rebound.,120748,,true,false,false,Garland,,Owens,,BC,,17,30,6,4,1,,,,,4,,,,6,Defensive Rebound,,,,42,42,
1,3,53,Will Magarity makes a layup shot. Alex Dragicevich with the assist.,122015,97479,true,true,false,Will,Alex,Magarity,Dragicevich,BC,BC,19,30,6,4,0,,,,,2,2,40,Layup Shot,3,Field Goal Made,0,0,0,42,42,
1,3,53,Pitt take a 20-second timeout.,,,false,false,false,,,,,,,19,30,6,4,0,,,,,0,,2,Short,11,Timeout,,,,47,47,
1,3,28,Offensive foul committed by Jamel Artis.,120758,,true,false,false,Jamel,,Artis,,Pitt,,19,30,7,4,2,,,,,7,,4,Offensive,8,Foul,,,,47,47,
1,3,28,Jamel Artis with a  turnover:,120758,,true,false,false,Jamel,,Artis,,Pitt,,19,30,7,4,2,,,,,7,,,,7,Turnover,,,,47,47,
1,3,28,Official TV timeout.,,,false,false,false,,,,,,,19,30,7,4,0,,,,,0,,3,Official TV,11,Timeout,,,,42,42,
1,2,58,Olivier Hanlan makes a jump shot from 19 feet out.,116003,,true,false,false,Olivier,,Hanlan,,BC,,21,30,7,4,0,,,,,9,2,45,Jump Shot,3,Field Goal Made,19,9.3,16.2,42,42,
1,2,19,Talib Zanna makes a jump shot from 14 feet out. Lamar Patterson with the assist.,88283,88282,true,true,false,Talib,Lamar,Zanna,Patterson,Pitt,Pitt,21,32,7,4,1,,,,,7,2,45,Jump Shot,3,Field Goal Made,14,-.4,13.5,47,47,
1,2,01,Olivier Hanlan makes a jump shot from 20 feet out.,116003,,true,false,false,Olivier,,Hanlan,,BC,,23,32,7,4,0,,,,,11,2,45,Jump Shot,3,Field Goal Made,20,14.2,14.2,42,42,
1,1,37,Personal foul committed by Alex Dragicevich.,97479,,true,false,false,Alex,,Dragicevich,,BC,,23,32,7,5,1,,,,,0,,1,Personal,8,Foul,,,,42,42,
1,1,23,Lamar Patterson misses a layup shot.,88282,,true,false,false,Lamar,,Patterson,,Pitt,,23,32,7,5,1,,,,,8,2,40,Layup Shot,4,Field Goal Missed,0,0,0,47,47,
1,1,23,Talib Zanna with an offensive rebound.,88283,,true,false,false,Talib,,Zanna,,Pitt,,23,32,7,5,1,,,,,7,,,,5,Offensive Rebound,,,,47,47,
1,1,20,Talib Zanna makes a tip shot from 4 feet out.,88283,,true,false,false,Talib,,Zanna,,Pitt,,23,34,7,5,1,,,,,9,2,53,Tip Shot,3,Field Goal Made,4,.4,3.5,47,47,
1,0,55.1,Alex Dragicevich misses a 3-point jump shot from 25 feet out.,97479,,true,false,false,Alex,,Dragicevich,,BC,,23,34,7,5,1,,,,,0,3,45,Jump Shot,4,Field Goal Missed,25,19.6,14.9,42,42,
1,0,55.1,Lamar Patterson with a defensive rebound.,88282,,true,false,false,Lamar,,Patterson,,Pitt,,23,34,7,5,1,,,,,8,,,,6,Defensive Rebound,,,,47,47,
1,0,51.9,Shooting foul committed by Olivier Hanlan.,116003,,true,false,false,Olivier,,Hanlan,,BC,,23,34,7,6,1,,,,,11,,2,Shooting,8,Foul,,,,42,42,
1,0,51.9,Michael Young misses free throw 1 of 2.,120761,,true,false,false,Michael,,Young,,Pitt,,23,34,7,6,0,,,,,0,1,11,Free Throw 1 of 2,2,Free Throw Missed,,,,47,47,
1,0,51.9,Pitt with an offensive rebound.,,,false,false,false,,,,,,,23,34,7,6,0,,,,,0,,,,5,Offensive Rebound,,,,47,47,
1,0,51.9,Michael Young makes free throw 2 of 2.,120761,,true,false,false,Michael,,Young,,Pitt,,23,35,7,6,0,,,,,1,1,12,Free Throw 2 of 2,1,Free Throw Made,,,,47,47,
1,0,16.1,Olivier Hanlan makes a 3-point jump shot from 23 feet out. Joe Rahon with the assist.,116003,116004,true,true,false,Olivier,Joe,Hanlan,Rahon,BC,BC,26,35,7,6,1,,,,,14,3,45,Jump Shot,3,Field Goal Made,23,-9.4,21.5,42,42,
1,0,00.2,Michael Young misses a 3-point jump shot from 22 feet out.,120761,,true,false,false,Michael,,Young,,Pitt,,26,35,7,6,0,,,,,1,3,45,Jump Shot,4,Field Goal Missed,22,14.2,17.4,47,47,
1,0,00.2,BC with a defensive rebound.,,,false,false,false,,,,,,,26,35,7,6,0,,,,,0,,,,6,Defensive Rebound,,,,42,42,
1,0,00,End of the 1st Half,,,false,false,false,,,,,,,26,35,7,6,0,,,,,0,,,,15,End Period,,,,42,42,
2,20,00,Start of the 2nd Half,,,false,false,false,,,,,,,26,35,0,0,0,,,,,0,,,,14,Start Period,,,,42,42,
2,19,39,Will Magarity misses a jump shot from 19 feet out.,122015,,true,false,false,Will,,Magarity,,BC,,26,35,0,0,0,,,,,2,2,45,Jump Shot,4,Field Goal Missed,19,-18.6,3.6,42,42,
2,19,39,Michael Young with a defensive rebound.,120761,,true,false,false,Michael,,Young,,Pitt,,26,35,0,0,0,,,,,1,,,,6,Defensive Rebound,,,,47,47,
2,19,19,Talib Zanna misses a hook shot from 4 feet out.,88283,,true,false,false,Talib,,Zanna,,Pitt,,26,35,0,0,1,,,,,9,2,55,Hook Shot,4,Field Goal Missed,4,.4,4.3,47,47,
2,19,19,Michael Young with an offensive rebound.,120761,,true,false,false,Michael,,Young,,Pitt,,26,35,0,0,0,,,,,1,,,,5,Offensive Rebound,,,,47,47,
2,19,14,Michael Young makes a tip shot from 2 feet out.,120761,,true,false,false,Michael,,Young,,Pitt,,26,37,0,0,0,,,,,3,2,53,Tip Shot,3,Field Goal Made,2,.4,2.3,47,47,
2,19,05,Ryan Anderson with a lost ball turnover: Lost Ball,110082,,true,false,false,Ryan,,Anderson,,BC,,26,37,0,0,1,,,,,2,,2,Lost Ball,7,Turnover,,,,42,42,
2,19,02,Lamar Patterson makes a 3-point jump shot from 23 feet out. James Robinson with the assist.,88282,116087,true,true,false,Lamar,James,Patterson,Robinson,Pitt,Pitt,26,40,0,0,1,,,,,11,3,45,Jump Shot,3,Field Goal Made,23,17,16,47,47,
2,18,31,Joe Rahon misses a 3-point jump shot from 23 feet out.,116004,,true,false,false,Joe,,Rahon,,BC,,26,40,0,0,0,,,,,0,3,45,Jump Shot,4,Field Goal Missed,23,14.4,17.4,42,42,
2,18,31,Cameron Wright with a defensive rebound.,97236,,true,false,false,Cameron,,Wright,,Pitt,,26,40,0,0,1,,,,,8,,,,6,Defensive Rebound,,,,47,47,
2,18,31,Cameron Wright with a out of bounds turnover: Out of Bounds,97236,,true,false,false,Cameron,,Wright,,Pitt,,26,40,0,0,1,,,,,8,,3,Out of Bounds,7,Turnover,,,,47,47,
2,18,15,Patrick Heckmann misses a 3-point jump shot from 24 feet out.,110086,,true,false,false,Patrick,,Heckmann,,BC,,26,40,0,0,2,,,,,4,3,45,Jump Shot,4,Field Goal Missed,24,17.3,16.4,42,42,
2,18,15,Ryan Anderson with an offensive rebound.,110082,,true,false,false,Ryan,,Anderson,,BC,,26,40,0,0,1,,,,,2,,,,5,Offensive Rebound,,,,42,42,
2,17,44,Ryan Anderson makes a layup shot. Joe Rahon with the assist.,110082,116004,true,true,false,Ryan,Joe,Anderson,Rahon,BC,BC,28,40,0,0,1,,,,,4,2,40,Layup Shot,3,Field Goal Made,0,0,0,42,42,
2,17,44,Shooting foul committed by Michael Young.,120761,,true,false,false,Michael,,Young,,Pitt,,28,40,1,0,1,,,,,3,,2,Shooting,8,Foul,,,,47,47,
2,17,44,Ryan Anderson makes free throw 1 of 1.,110082,,true,false,false,Ryan,,Anderson,,BC,,29,40,1,0,1,,,,,5,1,10,Free Throw 1 of 1,1,Free Throw Made,,,,42,42,
2,17,28,Cameron Wright makes a layup shot. Michael Young with the assist.,97236,120761,true,true,false,Cameron,Michael,Wright,Young,Pitt,Pitt,29,42,1,0,1,,,,,10,2,40,Layup Shot,3,Field Goal Made,0,0,0,47,47,
2,17,20,Personal foul committed by Talib Zanna.,88283,,true,false,false,Talib,,Zanna,,Pitt,,29,42,2,0,2,,,,,9,,1,Personal,8,Foul,,,,47,47,
2,17,11,Ryan Anderson makes a dunk shot. Joe Rahon with the assist.,110082,116004,true,true,false,Ryan,Joe,Anderson,Rahon,BC,BC,31,42,2,0,1,,,,,7,2,48,Dunk Shot,3,Field Goal Made,0,0,0,42,42,
2,17,01,Offensive foul committed by Talib Zanna.,88283,,true,false,false,Talib,,Zanna,,Pitt,,31,42,3,0,3,,,,,9,,4,Offensive,8,Foul,,,,47,47,
2,17,01,Talib Zanna with a  turnover:,88283,,true,false,false,Talib,,Zanna,,Pitt,,31,42,3,0,3,,,,,9,,,,7,Turnover,,,,47,47,
2,16,51,Olivier Hanlan makes a layup shot.,116003,,true,false,false,Olivier,,Hanlan,,BC,,33,42,3,0,1,,,,,16,2,40,Layup Shot,3,Field Goal Made,0,0,0,42,42,
2,16,19,Derrick Randall misses a hook shot from 4 feet out.,110181,,true,false,false,Derrick,,Randall,,Pitt,,33,42,3,0,1,,,,,2,2,55,Hook Shot,4,Field Goal Missed,4,-.9,4.2,47,47,
2,16,19,Patrick Heckmann with a defensive rebound.,110086,,true,false,false,Patrick,,Heckmann,,BC,,33,42,3,0,2,,,,,4,,,,6,Defensive Rebound,,,,42,42,
2,15,58,Patrick Heckmann makes a 3-point jump shot from 23 feet out. Olivier Hanlan with the assist.,110086,116003,true,true,false,Patrick,Olivier,Heckmann,Hanlan,BC,BC,36,42,3,0,2,,,,,7,3,45,Jump Shot,3,Field Goal Made,23,-22.9,.8,42,42,
2,15,58,Pitt take a full timeout.,,,false,false,false,,,,,,,36,42,3,0,0,,,,,0,,1,Regular,11,Timeout,,,,47,47,
2,15,33,Official TV timeout.,,,false,false,false,,,,,,,36,42,3,0,0,,,,,0,,3,Official TV,11,Timeout,,,,42,42,
2,15,25,Shooting foul committed by Lamar Patterson.,88282,,true,false,false,Lamar,,Patterson,,Pitt,,36,42,4,0,2,,,,,11,,2,Shooting,8,Foul,,,,47,47,
2,15,25,Garland Owens makes free throw 1 of 2.,120748,,true,false,false,Garland,,Owens,,BC,,37,42,4,0,1,,,,,5,1,11,Free Throw 1 of 2,1,Free Throw Made,,,,42,42,
2,15,25,Garland Owens misses free throw 2 of 2.,120748,,true,false,false,Garland,,Owens,,BC,,37,42,4,0,1,,,,,5,1,12,Free Throw 2 of 2,2,Free Throw Missed,,,,42,42,
2,15,25,Pitt with a defensive rebound.,,,false,false,false,,,,,,,37,42,4,0,0,,,,,0,,,,6,Defensive Rebound,,,,47,47,
2,15,24,Personal foul committed by Will Magarity.,122015,,true,false,false,Will,,Magarity,,BC,,37,42,4,1,1,,,,,2,,1,Personal,8,Foul,,,,42,42,
2,14,46,Lamar Patterson misses a 3-point jump shot from 23 feet out.,88282,,true,false,false,Lamar,,Patterson,,Pitt,,37,42,4,1,2,,,,,11,3,45,Jump Shot,4,Field Goal Missed,23,2.1,23.2,47,47,
2,14,46,Lonnie Jackson with a defensive rebound.,110084,,true,false,false,Lonnie,,Jackson,,BC,,37,42,4,1,0,,,,,0,,,,6,Defensive Rebound,,,,42,42,
2,14,31,Alex Dragicevich misses a layup shot.,97479,,true,false,false,Alex,,Dragicevich,,BC,,37,42,4,1,1,,,,,0,2,40,Layup Shot,4,Field Goal Missed,0,0,0,42,42,
2,14,31,Lamar Patterson with a defensive rebound.,88282,,true,false,false,Lamar,,Patterson,,Pitt,,37,42,4,1,2,,,,,11,,,,6,Defensive Rebound,,,,47,47,
2,14,23,Lamar Patterson makes a 3-point jump shot from 23 feet out. James Robinson with the assist.,88282,116087,true,true,false,Lamar,James,Patterson,Robinson,Pitt,Pitt,37,45,4,1,2,,,,,14,3,45,Jump Shot,3,Field Goal Made,23,-20.7,9.4,47,47,
2,14,03,Garland Owens with a lost ball turnover: Lost Ball,120748,,true,false,false,Garland,,Owens,,BC,,37,45,4,1,1,,,,,5,,2,Lost Ball,7,Turnover,,,,42,42,
2,13,50,Lamar Patterson with a lost ball turnover: Lost Ball,88282,,true,false,false,Lamar,,Patterson,,Pitt,,37,45,4,1,2,,,,,14,,2,Lost Ball,7,Turnover,,,,47,47,
2,13,46,Olivier Hanlan makes a layup shot.,116003,,true,false,false,Olivier,,Hanlan,,BC,,39,45,4,1,1,,,,,18,2,40,Layup Shot,3,Field Goal Made,0,0,0,42,42,
2,13,29,Shooting foul committed by Garland Owens.,120748,,true,false,false,Garland,,Owens,,BC,,39,45,4,2,2,,,,,5,,2,Shooting,8,Foul,,,,42,42,
