half,time-minutes,time-seconds,details,player1-id,player2-id,player1-linkable,player2-linkable,player3-linkable,player-first-name-1,player-first-name-2,player-last-name-1,player-last-name-2,player-team-alias-1,player-team-alias-2,home-score,visitor-score,visitor-fouls,home-fouls,player-fouls,fastbreak,in-paint,second-chance,off-turnover,player-score,points-type,detail-id,detail-desc,event-id,event-desc,distance,x-coord,y-coord,team-id-1,team-id-2,team-id-3
1,20,00,Start of the 1st Half,,,false,false,false,,,,,,,0,0,0,0,0,,,,,0,,,,14,Start Period,,,,17,17,
1,19,43,Joe Harris misses a jump shot from 12 feet out.,97108,,true,false,false,Joe,,Harris,,UVa,,0,0,0,0,0,,,,,0,2,45,Jump Shot,4,Field Goal Missed,12,-8.6,8.7,17,17,
1,19,43,Okaro White with a defensive rebound.,97445,,true,false,false,Okaro,,White,,FlaSt,,0,0,0,0,0,,,,,0,,,,6,Defensive Rebound,,,,12,12,
1,19,18,Devon Bookert makes a 3-point jump shot from 24 feet out. Montay Brandon with the assist.,116526,116527,true,true,false,Devon,Montay,Bookert,Brandon,FlaSt,FlaSt,0,3,0,0,0,,,,,3,3,45,Jump Shot,3,Field Goal Made,24,-20.3,13.3,12,12,
1,18,57,Akil Mitchell misses a jump shot from 17 feet out.,97111,,true,false,false,Akil,,Mitchell,,UVa,,0,3,0,0,0,,,,,0,2,45,Jump Shot,4,Field Goal Missed,17,6.9,15.2,17,17,
1,18,57,London Perrantes with an offensive rebound.,120610,,true,false,false,London,,Perrantes,,UVa,,0,3,0,0,0,,,,,0,,,,5,Offensive Rebound,,,,17,17,
1,18,35,Malcolm Brogdon misses a jump shot from 14 feet out.,109418,,true,false,false,Malcolm,,Brogdon,,UVa,,0,3,0,0,0,,,,,0,2,45,Jump Shot,4,Field Goal Missed,14,13.9,1.6,17,17,
1,18,35,Mike Tobey with an offensive rebound.,116698,,true,false,false,Mike,,Tobey,,UVa,,0,3,0,0,0,,,,,0,,,,5,Offensive Rebound,,,,17,17,
1,18,20,Mike Tobey makes a layup shot. Joe Harris with the assist.,116698,97108,true,true,false,Mike,Joe,Tobey,Harris,UVa,UVa,2,3,0,0,0,,,,,2,2,40,Layup Shot,3,Field Goal Made,0,0,0,17,17,
1,17,39,Boris Bojanovsky misses a jump shot from 9 feet out.,116525,,true,false,false,Boris,,Bojanovsky,,FlaSt,,2,3,0,0,0,,,,,0,2,45,Jump Shot,4,Field Goal Missed,9,-7.9,3.8,12,12,
1,17,39,UVa with a defensive rebound.,,,false,false,false,,,,,,,2,3,0,0,0,,,,,0,,,,6,Defensive Rebound,,,,17,17,
1,17,38,Personal foul committed by Boris Bojanovsky.,116525,,true,false,false,Boris,,Bojanovsky,,FlaSt,,2,3,1,0,1,,,,,0,,1,Personal,8,Foul,,,,12,12,
1,17,24,Malcolm Brogdon makes a 3-point jump shot from 24 feet out. London Perrantes with the assist.,109418,120610,true,true,false,Malcolm,London,Brogdon,Perrantes,UVa,UVa,5,3,1,0,0,,,,,3,3,45,Jump Shot,3,Field Goal Made,24,-18.3,15.4,17,17,
1,17,04,Michael Ojo with a bad pass turnover: Bad Pass,116530,,true,false,false,Michael,,Ojo,,FlaSt,,5,3,1,0,0,,,,,0,,1,Bad Pass,7,Turnover,,,,12,12,
1,16,51,Malcolm Brogdon misses a layup shot.,109418,,true,false,false,Malcolm,,Brogdon,,UVa,,5,3,1,0,0,,,,,3,2,40,Layup Shot,4,Field Goal Missed,0,0,0,17,17,
1,16,51,UVa with an offensive rebound.,,,false,false,false,,,,,,,5,3,1,0,0,,,,,0,,,,5,Offensive Rebound,,,,17,17,
1,16,34,Akil Mitchell makes a layup shot. Joe Harris with the assist.,97111,97108,true,true,false,Akil,Joe,Mitchell,Harris,UVa,UVa,7,3,1,0,0,,,,,2,2,40,Layup Shot,3,Field Goal Made,0,0,0,17,17,
1,16,24,Ian Miller with a traveling turnover: Traveling,97446,,true,false,false,Ian,,Miller,,FlaSt,,7,3,1,0,0,,,,,0,,4,Traveling,7,Turnover,,,,12,12,
1,16,03,Malcolm Brogdon makes a layup shot.,109418,,true,false,false,Malcolm,,Brogdon,,UVa,,9,3,1,0,0,,,,,5,2,40,Layup Shot,3,Field Goal Made,0,0,0,17,17,
1,15,40,FlaSt take a 20-second timeout.,,,false,false,false,,,,,,,9,3,1,0,0,,,,,0,,2,Short,11,Timeout,,,,12,12,
1,15,28,Michael Ojo misses a layup shot.,116530,,true,false,false,Michael,,Ojo,,FlaSt,,9,3,1,0,0,,,,,0,2,40,Layup Shot,4,Field Goal Missed,0,0,0,12,12,
1,15,28,Mike Tobey with a defensive rebound.,116698,,true,false,false,Mike,,Tobey,,UVa,,9,3,1,0,0,,,,,2,,,,6,Defensive Rebound,,,,17,17,
1,15,11,London Perrantes misses a 3-point jump shot from 25 feet out.,120610,,true,false,false,London,,Perrantes,,UVa,,9,3,1,0,0,,,,,0,3,45,Jump Shot,4,Field Goal Missed,25,14.4,20.7,17,17,
1,15,11,Aaron Thomas with a defensive rebound.,116531,,true,false,false,Aaron,,Thomas,,FlaSt,,9,3,1,0,0,,,,,0,,,,6,Defensive Rebound,,,,12,12,
1,15,00,Aaron Thomas misses a layup shot.,116531,,true,false,false,Aaron,,Thomas,,FlaSt,,9,3,1,0,0,,,,,0,2,40,Layup Shot,4,Field Goal Missed,0,0,0,12,12,
1,15,00,Akil Mitchell with a defensive rebound.,97111,,true,false,false,Akil,,Mitchell,,UVa,,9,3,1,0,0,,,,,2,,,,6,Defensive Rebound,,,,17,17,
1,14,48,Shooting foul committed by Michael Ojo.,116530,,true,false,false,Michael,,Ojo,,FlaSt,,9,3,2,0,1,,,,,0,,2,Shooting,8,Foul,,,,12,12,
1,14,48,Official TV timeout.,,,false,false,false,,,,,,,9,3,2,0,0,,,,,0,,3,Official TV,11,Timeout,,,,17,17,
1,14,48,London Perrantes makes free throw 1 of 2.,120610,,true,false,false,London,,Perrantes,,UVa,,10,3,2,0,0,,,,,1,1,11,Free Throw 1 of 2,1,Free Throw Made,,,,17,17,
1,14,48,London Perrantes makes free throw 2 of 2.,120610,,true,false,false,London,,Perrantes,,UVa,,11,3,2,0,0,,,,,2,1,12,Free Throw 2 of 2,1,Free Throw Made,,,,17,17,
1,14,33,Ian Miller misses a 3-point jump shot from 24 feet out.,97446,,true,false,false,Ian,,Miller,,FlaSt,,11,3,2,0,0,,,,,0,3,45,Jump Shot,4,Field Goal Missed,24,-17.1,16.9,12,12,
1,14,33,Malcolm Brogdon with a defensive rebound.,109418,,true,false,false,Malcolm,,Brogdon,,UVa,,11,3,2,0,0,,,,,5,,,,6,Defensive Rebound,,,,17,17,
1,14,15,Justin Anderson makes a 3-point jump shot from 24 feet out. Malcolm Brogdon with the assist.,116701,109418,true,true,false,Justin,Malcolm,Anderson,Brogdon,UVa,UVa,14,3,2,0,0,,,,,3,3,45,Jump Shot,3,Field Goal Made,24,17.8,16.4,17,17,
1,13,46,Offensive foul committed by Montay Brandon.,116527,,true,false,false,Montay,,Brandon,,FlaSt,,14,3,3,0,1,,,,,0,,4,Offensive,8,Foul,,,,12,12,
1,13,46,Montay Brandon with a  turnover:,116527,,true,false,false,Montay,,Brandon,,FlaSt,,14,3,3,0,1,,,,,0,,,,7,Turnover,,,,12,12,
1,13,26,Offensive foul committed by Justin Anderson.,116701,,true,false,false,Justin,,Anderson,,UVa,,14,3,3,1,1,,,,,3,,4,Offensive,8,Foul,,,,17,17,
1,13,26,Justin Anderson with a  turnover:,116701,,true,false,false,Justin,,Anderson,,UVa,,14,3,3,1,1,,,,,3,,,,7,Turnover,,,,17,17,
1,13,02,Okaro White makes a layup shot. Aaron Thomas with the assist.,97445,116531,true,true,false,Okaro,Aaron,White,Thomas,FlaSt,FlaSt,14,5,3,1,0,,,,,2,2,40,Layup Shot,3,Field Goal Made,0,0,0,12,12,
1,12,26,Mike Tobey misses a layup shot.,116698,,true,false,false,Mike,,Tobey,,UVa,,14,5,3,1,0,,,,,2,2,40,Layup Shot,4,Field Goal Missed,0,0,0,17,17,
1,12,26,Anthony Gill with an offensive rebound.,109947,,true,false,false,Anthony,,Gill,,UVa,,14,5,3,1,0,,,,,0,,,,5,Offensive Rebound,,,,17,17,
1,12,21,Personal foul committed by Okaro White.,97445,,true,false,false,Okaro,,White,,FlaSt,,14,5,4,1,1,,,,,2,,1,Personal,8,Foul,,,,12,12,
1,12,21,Anthony Gill misses free throw 1 of 2.,109947,,true,false,false,Anthony,,Gill,,UVa,,14,5,4,1,0,,,,,0,1,11,Free Throw 1 of 2,2,Free Throw Missed,,,,17,17,
1,12,21,UVa with an offensive rebound.,,,false,false,false,,,,,,,14,5,4,1,0,,,,,0,,,,5,Offensive Rebound,,,,17,17,
1,12,21,Anthony Gill makes free throw 2 of 2.,109947,,true,false,false,Anthony,,Gill,,UVa,,15,5,4,1,0,,,,,1,1,12,Free Throw 2 of 2,1,Free Throw Made,,,,17,17,
1,12,08,Aaron Thomas misses a layup shot.,116531,,true,false,false,Aaron,,Thomas,,FlaSt,,15,5,4,1,0,,,,,0,2,40,Layup Shot,4,Field Goal Missed,0,0,0,12,12,
1,12,08,Boris Bojanovsky with an offensive rebound.,116525,,true,false,false,Boris,,Bojanovsky,,FlaSt,,15,5,4,1,1,,,,,0,,,,5,Offensive Rebound,,,,12,12,
1,12,00,Boris Bojanovsky misses a layup shot.,116525,,true,false,false,Boris,,Bojanovsky,,FlaSt,,15,5,4,1,1,,,,,0,2,40,Layup Shot,4,Field Goal Missed,0,0,0,12,12,
1,12,00,Ian Miller with an offensive rebound.,97446,,true,false,false,Ian,,Miller,,FlaSt,,15,5,4,1,0,,,,,0,,,,5,Offensive Rebound,,,,12,12,
1,11,55,Ian Miller makes a 3-point layup shot from 24 feet out.,97446,,true,false,false,Ian,,Miller,,FlaSt,,15,8,4,1,0,,,,,3,3,40,Layup Shot,3,Field Goal Made,24,-21,11,12,12,
1,11,38,Justin Anderson makes a jump shot from 18 feet out. Mike Tobey with the assist.,116701,116698,true,true,false,Justin,Mike,Anderson,Tobey,UVa,UVa,17,8,4,1,1,,,,,5,2,45,Jump Shot,3,Field Goal Made,18,13,12,17,17,
1,11,15,Devon Bookert misses a layup shot.,116526,,true,false,false,Devon,,Bookert,,FlaSt,,17,8,4,1,0,,,,,3,2,40,Layup Shot,4,Field Goal Missed,0,0,0,12,12,
1,11,15,Anthony Gill with a defensive rebound.,109947,,true,false,false,Anthony,,Gill,,UVa,,17,8,4,1,0,,,,,1,,,,6,Defensive Rebound,,,,17,17,
1,11,07,Malcolm Brogdon makes a layup shot.,109418,,true,false,false,Malcolm,,Brogdon,,UVa,,19,8,4,1,0,,,,,7,2,40,Layup Shot,3,Field Goal Made,0,0,0,17,17,
1,11,07,Shooting foul committed by Boris Bojanovsky.,116525,,true,false,false,Boris,,Bojanovsky,,FlaSt,,19,8,5,1,2,,,,,0,,2,Shooting,8,Foul,,,,12,12,
1,11,07,Official TV timeout.,,,false,false,false,,,,,,,19,8,5,1,0,,,,,0,,3,Official TV,11,Timeout,,,,17,17,
1,11,07,Malcolm Brogdon makes free throw 1 of 1.,109418,,true,false,false,Malcolm,,Brogdon,,UVa,,20,8,5,1,0,,,,,8,1,10,Free Throw 1 of 1,1,Free Throw Made,,,,17,17,
1,10,58,Ian Miller with a lost ball turnover: Lost Ball,97446,,true,false,false,Ian,,Miller,,FlaSt,,20,8,5,1,0,,,,,3,,2,Lost Ball,7,Turnover,,,,12,12,
1,10,54,Anthony Gill makes a dunk shot. Malcolm Brogdon with the assist.,109947,109418,true,true,false,Anthony,Malcolm,Gill,Brogdon,UVa,UVa,22,8,5,1,0,,,,,3,2,48,Dunk Shot,3,Field Goal Made,0,0,0,17,17,
1,10,12,Personal foul committed by Mike Tobey.,116698,,true,false,false,Mike,,Tobey,,UVa,,22,8,5,2,1,,,,,2,,1,Personal,8,Foul,,,,17,17,
1,10,12,Michael Ojo misses free throw 1 of 2.,116530,,true,false,false,Michael,,Ojo,,FlaSt,,22,8,5,2,1,,,,,0,1,11,Free Throw 1 of 2,2,Free Throw Missed,,,,12,12,
1,10,12,FlaSt with an offensive rebound.,,,false,false,false,,,,,,,22,8,5,2,0,,,,,0,,,,5,Offensive Rebound,,,,12,12,
1,10,12,Michael Ojo makes free throw 2 of 2.,116530,,true,false,false,Michael,,Ojo,,FlaSt,,22,9,5,2,1,,,,,1,1,12,Free Throw 2 of 2,1,Free Throw Made,,,,12,12,
1,10,02,Joe Harris makes a 3-point jump shot from 25 feet out. Malcolm Brogdon with the assist.,97108,109418,true,true,false,Joe,Malcolm,Harris,Brogdon,UVa,UVa,25,9,5,2,0,,,,,3,3,45,Jump Shot,3,Field Goal Made,25,20,15,17,17,
1,9,40,Personal foul committed by Anthony Gill.,109947,,true,false,false,Anthony,,Gill,,UVa,,25,9,5,3,1,,,,,3,,1,Personal,8,Foul,,,,17,17,
1,9,32,Aaron Thomas makes a jump shot from 10 feet out.,116531,,true,false,false,Aaron,,Thomas,,FlaSt,,25,11,5,3,0,,,,,2,2,45,Jump Shot,3,Field Goal Made,10,-5.7,8.2,12,12,
1,9,09,Personal foul committed by Devon Bookert.,116526,,true,false,false,Devon,,Bookert,,FlaSt,,25,11,6,3,1,,,,,3,,1,Personal,8,Foul,,,,12,12,
1,8,52,Malcolm Brogdon with a lost ball turnover: Lost Ball,109418,,true,false,false,Malcolm,,Brogdon,,UVa,,25,11,6,3,0,,,,,8,,2,Lost Ball,7,Turnover,,,,17,17,
1,8,34,Montay Brandon misses a jump shot from 16 feet out.,116527,,true,false,false,Montay,,Brandon,,FlaSt,,25,11,6,3,1,,,,,0,2,45,Jump Shot,4,Field Goal Missed,16,-8.6,14,12,12,
1,8,34,FlaSt with an offensive rebound.,,,false,false,false,,,,,,,25,11,6,3,0,,,,,0,,,,5,Offensive Rebound,,,,12,12,
1,8,28,Personal foul committed by Akil Mitchell.,97111,,true,false,false,Akil,,Mitchell,,UVa,,25,11,6,4,1,,,,,2,,1,Personal,8,Foul,,,,17,17,
1,8,24,Devon Bookert misses a jump shot from 13 feet out.,116526,,true,false,false,Devon,,Bookert,,FlaSt,,25,11,6,4,1,,,,,3,2,45,Jump Shot,4,Field Goal Missed,13,-11.1,6.2,12,12,
1,8,24,Malcolm Brogdon with a defensive rebound.,109418,,true,false,false,Malcolm,,Brogdon,,UVa,,25,11,6,4,0,,,,,8,,,,6,Defensive Rebound,,,,17,17,
1,8,08,Justin Anderson makes a 3-point jump shot from 24 feet out. Malcolm Brogdon with the assist.,116701,109418,true,true,false,Justin,Malcolm,Anderson,Brogdon,UVa,UVa,28,11,6,4,1,,,,,8,3,45,Jump Shot,3,Field Goal Made,24,18.6,14.5,17,17,
1,7,48,Michael Ojo makes a layup shot. Aaron Thomas with the assist.,116530,116531,true,true,false,Michael,Aaron,Ojo,Thomas,FlaSt,FlaSt,28,13,6,4,1,,,,,3,2,40,Layup Shot,3,Field Goal Made,0,0,0,12,12,
1,7,38,Akil Mitchell misses a layup shot.,97111,,true,false,false,Akil,,Mitchell,,UVa,,28,13,6,4,1,,,,,2,2,40,Layup Shot,4,Field Goal Missed,0,0,0,17,17,
1,7,38,Okaro White with a defensive rebound.,97445,,true,false,false,Okaro,,White,,FlaSt,,28,13,6,4,1,,,,,2,,,,6,Defensive Rebound,,,,12,12,
1,7,26,Okaro White makes a dunk shot. Devon Bookert with the assist.,97445,116526,true,true,false,Okaro,Devon,White,Bookert,FlaSt,FlaSt,28,15,6,4,1,,,,,4,2,48,Dunk Shot,3,Field Goal Made,0,0,0,12,12,
1,7,13,Justin Anderson misses a layup shot.,116701,,true,false,false,Justin,,Anderson,,UVa,,28,15,6,4,1,,,,,8,2,40,Layup Shot,4,Field Goal Missed,0,0,0,17,17,
1,7,13,Akil Mitchell with an offensive rebound.,97111,,true,false,false,Akil,,Mitchell,,UVa,,28,15,6,4,1,,,,,2,,,,5,Offensive Rebound,,,,17,17,
1,7,13,Akil Mitchell misses a layup shot.,97111,,true,false,false,Akil,,Mitchell,,UVa,,28,15,6,4,1,,,,,2,2,40,Layup Shot,4,Field Goal Missed,0,0,0,17,17,
1,7,13,Aaron Thomas with a defensive rebound.,116531,,true,false,false,Aaron,,Thomas,,FlaSt,,28,15,6,4,0,,,,,2,,,,6,Defensive Rebound,,,,12,12,
1,7,06,Aaron Thomas with a lost ball turnover: Lost Ball,116531,,true,false,false,Aaron,,Thomas,,FlaSt,,28,15,6,4,0,,,,,2,,2,Lost Ball,7,Turnover,,,,12,12,
1,7,02,Mike Tobey makes a dunk shot. Malcolm Brogdon with the assist.,116698,109418,true,true,false,Mike,Malcolm,Tobey,Brogdon,UVa,UVa,30,15,6,4,1,,,,,4,2,48,Dunk Shot,3,Field Goal Made,0,0,0,17,17,
1,6,48,Okaro White with a lost ball turnover: Lost Ball,97445,,true,false,false,Okaro,,White,,FlaSt,,30,15,6,4,1,,,,,4,,2,Lost Ball,7,Turnover,,,,12,12,
1,6,48,Official TV timeout.,,,false,false,false,,,,,,,30,15,6,4,0,,,,,0,,3,Official TV,11,Timeout,,,,17,17,
1,6,28,Justin Anderson with a bad pass turnover: Bad Pass,116701,,true,false,false,Justin,,Anderson,,UVa,,30,15,6,4,1,,,,,8,,1,Bad Pass,7,Turnover,,,,17,17,
1,6,17,Robert Gilchrist with a traveling turnover: Traveling,116528,,true,false,false,Robert,,Gilchrist,,FlaSt,,30,15,6,4,0,,,,,0,,4,Traveling,7,Turnover,,,,12,12,
1,6,08,Joe Harris makes a 3-point jump shot from 25 feet out. Justin Anderson with the assist.,97108,116701,true,true,false,Joe,Justin,Harris,Anderson,UVa,UVa,33,15,6,4,0,,,,,6,3,45,Jump Shot,3,Field Goal Made,25,1.1,24.7,17,17,
1,5,41,Personal foul committed by Justin Anderson.,116701,,true,false,false,Justin,,Anderson,,UVa,,33,15,6,5,2,,,,,8,,1,Personal,8,Foul,,,,17,17,
1,5,37,Personal foul committed by Darion Atkins.,109419,,true,false,false,Darion,,Atkins,,UVa,,33,15,6,6,1,,,,,0,,1,Personal,8,Foul,,,,17,17,
1,5,37,Okaro White makes free throw 1st of 1-and-1.,97445,,true,false,false,Okaro,,White,,FlaSt,,33,16,6,6,1,,,,,5,1,8,Free Throw 1st of 1-and-1,1,Free Throw Made,,,,12,12,
1,5,37,Okaro White makes free throw 2 of 2.,97445,,true,false,false,Okaro,,White,,FlaSt,,33,17,6,6,1,,,,,6,1,12,Free Throw 2 of 2,1,Free Throw Made,,,,12,12,
1,5,22,London Perrantes with a lost ball turnover: Lost Ball,120610,,true,false,false,London,,Perrantes,,UVa,,33,17,6,6,0,,,,,2,,2,Lost Ball,7,Turnover,,,,17,17,
1,5,18,Personal foul committed by Darion Atkins.,109419,,true,false,false,Darion,,Atkins,,UVa,,33,17,6,7,2,,,,,0,,1,Personal,8,Foul,,,,17,17,
1,5,18,Aaron Thomas makes free throw 1st of 1-and-1.,116531,,true,false,false,Aaron,,Thomas,,FlaSt,,33,18,6,7,0,,,,,3,1,8,Free Throw 1st of 1-and-1,1,Free Throw Made,,,,12,12,
1,5,18,Aaron Thomas makes free throw 2 of 2.,116531,,true,false,false,Aaron,,Thomas,,FlaSt,,33,19,6,7,0,,,,,4,1,12,Free Throw 2 of 2,1,Free Throw Made,,,,12,12,
1,5,01,Malcolm Brogdon misses a layup shot.,109418,,true,false,false,Malcolm,,Brogdon,,UVa,,33,19,6,7,0,,,,,8,2,40,Layup Shot,4,Field Goal Missed,0,0,0,17,17,
1,5,01,Devon Bookert with a defensive rebound.,116526,,true,false,false,Devon,,Bookert,,FlaSt,,33,19,6,7,1,,,,,3,,,,6,Defensive Rebound,,,,12,12,
1,4,52,Devon Bookert makes a layup shot.,116526,,true,false,false,Devon,,Bookert,,FlaSt,,33,21,6,7,1,,,,,5,2,40,Layup Shot,3,Field Goal Made,0,0,0,12,12,
1,4,36,Personal foul committed by Robert Gilchrist.,116528,,true,false,false,Robert,,Gilchrist,,FlaSt,,33,21,7,7,1,,,,,0,,1,Personal,8,Foul,,,,12,12,
1,4,36,Anthony Gill makes free throw 1st of 1-and-1.,109947,,true,false,false,Anthony,,Gill,,UVa,,34,21,7,7,1,,,,,4,1,8,Free Throw 1st of 1-and-1,1,Free Throw Made,,,,17,17,
1,4,36,Anthony Gill misses free throw 2nd of 1-and-1.,109947,,true,false,false,Anthony,,Gill,,UVa,,34,21,7,7,1,,,,,4,1,9,Free Throw 2nd of 1-and-1,2,Free Throw Missed,,,,17,17,
1,4,36,Okaro White with a defensive rebound.,97445,,true,false,false,Okaro,,White,,FlaSt,,34,21,7,7,1,,,,,6,,,,6,Defensive Rebound,,,,12,12,
1,4,29,Ian Miller misses a 3-point jump shot from 25 feet out.,97446,,true,false,false,Ian,,Miller,,FlaSt,,34,21,7,7,0,,,,,3,3,45,Jump Shot,4,Field Goal Missed,25,-20.8,14.5,12,12,
1,4,29,Anthony Gill with a defensive rebound.,109947,,true,false,false,Anthony,,Gill,,UVa,,34,21,7,7,1,,,,,4,,,,6,Defensive Rebound,,,,17,17,
1,4,07,Anthony Gill misses a layup shot.,109947,,true,false,false,Anthony,,Gill,,UVa,,34,21,7,7,1,,,,,4,2,40,Layup Shot,4,Field Goal Missed,0,0,0,17,17,
1,4,07,Devon Bookert with a defensive rebound.,116526,,true,false,false,Devon,,Bookert,,FlaSt,,34,21,7,7,1,,,,,5,,,,6,Defensive Rebound,,,,12,12,
1,3,57,Michael Ojo with a lost ball turnover: Lost Ball,116530,,true,false,false,Michael,,Ojo,,FlaSt,,34,21,7,7,1,,,,,3,,2,Lost Ball,7,Turnover,,,,12,12,
1,3,48,Malcolm Brogdon misses a layup shot.,109418,,true,false,false,Malcolm,,Brogdon,,UVa,,34,21,7,7,0,,,,,8,2,40,Layup Shot,4,Field Goal Missed,0,0,0,17,17,
1,3,48,Montay Brandon with a defensive rebound.,116527,,true,false,false,Montay,,Brandon,,FlaSt,,34,21,7,7,1,,,,,0,,,,6,Defensive Rebound,,,,12,12,
1,3,47,Official TV timeout.,,,false,false,false,,,,,,,34,21,7,7,0,,,,,0,,3,Official TV,11,Timeout,,,,17,17,
1,3,31,Okaro White misses a jump shot from 10 feet out.,97445,,true,false,false,Okaro,,White,,FlaSt,,34,21,7,7,1,,,,,6,2,45,Jump Shot,4,Field Goal Missed,10,-4.5,8.7,12,12,
1,3,31,Okaro White with an offensive rebound.,97445,,true,false,false,Okaro,,White,,FlaSt,,34,21,7,7,1,,,,,6,,,,5,Offensive Rebound,,,,12,12,
1,3,25,Michael Ojo makes a layup shot.,116530,,true,false,false,Michael,,Ojo,,FlaSt,,34,23,7,7,1,,,,,5,2,40,Layup Shot,3,Field Goal Made,0,0,0,12,12,
1,3,09,Joe Harris makes a layup shot.,97108,,true,false,false,Joe,,Harris,,UVa,,36,23,7,7,0,,,,,8,2,40,Layup Shot,3,Field Goal Made,0,0,0,17,17,
1,2,51,Michael Ojo with a traveling turnover: Traveling,116530,,true,false,false,Michael,,Ojo,,FlaSt,,36,23,7,7,1,,,,,5,,4,Traveling,7,Turnover,,,,12,12,
1,2,29,Akil Mitchell makes a jump shot from 12 feet out.,97111,,true,false,false,Akil,,Mitchell,,UVa,,38,23,7,7,1,,,,,4,2,45,Jump Shot,3,Field Goal Made,12,5.5,10.6,17,17,
1,2,07,Ian Miller with a lost ball turnover: Lost Ball,97446,,true,false,false,Ian,,Miller,,FlaSt,,38,23,7,7,0,,,,,3,,2,Lost Ball,7,Turnover,,,,12,12,
1,2,02,Akil Mitchell makes a dunk shot. London Perrantes with the assist.,97111,120610,true,true,false,Akil,London,Mitchell,Perrantes,UVa,UVa,40,23,7,7,1,,,,,6,2,48,Dunk Shot,3,Field Goal Made,0,0,0,17,17,
1,1,23,Aaron Thomas with a lost ball turnover: Lost Ball,116531,,true,false,false,Aaron,,Thomas,,FlaSt,,40,23,7,7,0,,,,,4,,2,Lost Ball,7,Turnover,,,,12,12,
1,1,15,Malcolm Brogdon misses a layup shot.,109418,,true,false,false,Malcolm,,Brogdon,,UVa,,40,23,7,7,0,,,,,8,2,40,Layup Shot,4,Field Goal Missed,0,0,0,17,17,
1,1,15,Malcolm Brogdon with an offensive rebound.,109418,,true,false,false,Malcolm,,Brogdon,,UVa,,40,23,7,7,0,,,,,8,,,,5,Offensive Rebound,,,,17,17,
1,0,58.8,Personal foul committed by Ian Miller.,97446,,true,false,false,Ian,,Miller,,FlaSt,,40,23,8,7,1,,,,,3,,1,Personal,8,Foul,,,,12,12,
1,0,58.8,Mike Tobey makes free throw 1 of 2.,116698,,true,false,false,Mike,,Tobey,,UVa,,41,23,8,7,1,,,,,5,1,11,Free Throw 1 of 2,1,Free Throw Made,,,,17,17,
1,0,58.8,Mike Tobey makes free throw 2 of 2.,116698,,true,false,false,Mike,,Tobey,,UVa,,42,23,8,7,1,,,,,6,1,12,Free Throw 2 of 2,1,Free Throw Made,,,,17,17,
1,0,47.5,Ian Miller misses a 3-point jump shot from 27 feet out.,97446,,true,false,false,Ian,,Miller,,FlaSt,,42,23,8,7,1,,,,,3,3,45,Jump Shot,4,Field Goal Missed,27,-21.9,15,12,12,
1,0,47.5,UVa with a defensive rebound.,,,false,false,false,,,,,,,42,23,8,7,0,,,,,0,,,,6,Defensive Rebound,,,,17,17,
1,0,43.6,Personal foul committed by Okaro White.,97445,,true,false,false,Okaro,,White,,FlaSt,,42,23,9,7,2,,,,,6,,1,Personal,8,Foul,,,,12,12,
1,0,43.6,Akil Mitchell makes free throw 1 of 2.,97111,,true,false,false,Akil,,Mitchell,,UVa,,43,23,9,7,1,,,,,7,1,11,Free Throw 1 of 2,1,Free Throw Made,,,,17,17,
1,0,43.6,Akil Mitchell misses free throw 2 of 2.,97111,,true,false,false,Akil,,Mitchell,,UVa,,43,23,9,7,1,,,,,7,1,12,Free Throw 2 of 2,2,Free Throw Missed,,,,17,17,
1,0,43.6,Jarquez Smith with a defensive rebound.,120597,,true,false,false,Jarquez,,Smith,,FlaSt,,43,23,9,7,0,,,,,0,,,,6,Defensive Rebound,,,,12,12,
1,0,24.3,Aaron Thomas makes a 3-point jump shot from 24 feet out. Ian Miller with the assist.,116531,97446,true,true,false,Aaron,Ian,Thomas,Miller,FlaSt,FlaSt,43,26,9,7,0,,,,,7,3,45,Jump Shot,3,Field Goal Made,24,-20.7,11.6,12,12,
1,0,02.8,Joe Harris makes a layup shot.,97108,,true,false,false,Joe,,Harris,,UVa,,45,26,9,7,0,,,,,10,2,40,Layup Shot,3,Field Goal Made,0,0,0,17,17,
1,0,00,End of the 1st Half,,,false,false,false,,,,,,,45,26,9,7,0,,,,,0,,,,15,End Period,,,,17,17,
2,20,00,Start of the 2nd Half,,,false,false,false,,,,,,,45,26,0,0,0,,,,,0,,,,14,Start Period,,,,17,17,
2,19,48,Mike Tobey misses a jump shot from 14 feet out.,116698,,true,false,false,Mike,,Tobey,,UVa,,45,26,0,0,1,,,,,6,2,45,Jump Shot,4,Field Goal Missed,14,9.6,10.8,17,17,
2,19,48,FlaSt with a defensive rebound.,,,false,false,false,,,,,,,45,26,0,0,0,,,,,0,,,,6,Defensive Rebound,,,,12,12,
2,19,30,Boris Bojanovsky with a lost ball turnover: Lost Ball,116525,,true,false,false,Boris,,Bojanovsky,,FlaSt,,45,26,0,0,2,,,,,0,,2,Lost Ball,7,Turnover,,,,12,12,
2,19,25,Joe Harris misses a 3-point jump shot from 27 feet out.,97108,,true,false,false,Joe,,Harris,,UVa,,45,26,0,0,0,,,,,10,3,45,Jump Shot,4,Field Goal Missed,27,19,19.8,17,17,
2,19,25,Robert Gilchrist with a defensive rebound.,116528,,true,false,false,Robert,,Gilchrist,,FlaSt,,45,26,0,0,1,,,,,0,,,,6,Defensive Rebound,,,,12,12,
2,19,14,Devon Bookert misses a jump shot from 14 feet out.,116526,,true,false,false,Devon,,Bookert,,FlaSt,,45,26,0,0,1,,,,,5,2,45,Jump Shot,4,Field Goal Missed,14,-11.5,7.7,12,12,
2,19,14,UVa with a defensive rebound.,,,false,false,false,,,,,,,45,26,0,0,0,,,,,0,,,,6,Defensive Rebound,,,,17,17,
2,18,49,Akil Mitchell with a traveling turnover: Traveling,97111,,true,false,false,Akil,,Mitchell,,UVa,,45,26,0,0,1,,,,,7,,4,Traveling,7,Turnover,,,,17,17,
2,18,39,Boris Bojanovsky with a lost ball turnover: Lost Ball,116525,,true,false,false,Boris,,Bojanovsky,,FlaSt,,45,26,0,0,2,,,,,0,,2,Lost Ball,7,Turnover,,,,12,12,
2,18,36,Personal foul committed by Montay Brandon.,116527,,true,false,false,Montay,,Brandon,,FlaSt,,45,26,1,0,2,,,,,0,,1,Personal,8,Foul,,,,12,12,
2,18,16,Shooting foul committed by Okaro White.,97445,,true,false,false,Okaro,,White,,FlaSt,,45,26,2,0,3,,,,,6,,2,Shooting,8,Foul,,,,12,12,
2,18,16,Mike Tobey makes free throw 1 of 2.,116698,,true,false,false,Mike,,Tobey,,UVa,,46,26,2,0,1,,,,,7,1,11,Free Throw 1 of 2,1,Free Throw Made,,,,17,17,
2,18,16,Mike Tobey makes free throw 2 of 2.,116698,,true,false,false,Mike,,Tobey,,UVa,,47,26,2,0,1,,,,,8,1,12,Free Throw 2 of 2,1,Free Throw Made,,,,17,17,
2,18,06,Personal foul committed by Mike Tobey.,116698,,true,false,false,Mike,,Tobey,,UVa,,47,26,2,1,2,,,,,8,,1,Personal,8,Foul,,,,17,17,
2,17,59,Okaro White makes a dunk shot. Aaron Thomas with the assist.,97445,116531,true,true,false,Okaro,Aaron,White,Thomas,FlaSt,FlaSt,47,28,2,1,3,,,,,8,2,48,Dunk Shot,3,Field Goal Made,0,0,0,12,12,
2,17,44,Malcolm Brogdon misses a 3-point jump shot from 26 feet out.,109418,,true,false,false,Malcolm,,Brogdon,,UVa,,47,28,2,1,0,,,,,8,3,45,Jump Shot,4,Field Goal Missed,26,19.6,17.4,17,17,
2,17,44,Aaron Thomas with a defensive rebound.,116531,,true,false,false,Aaron,,Thomas,,FlaSt,,47,28,2,1,0,,,,,7,,,,6,Defensive Rebound,,,,12,12,
2,17,30,Ian Miller misses a 3-point jump shot from 25 feet out.,97446,,true,false,false,Ian,,Miller,,FlaSt,,47,28,2,1,1,,,,,3,3,45,Jump Shot,4,Field Goal Missed,25,-18.3,17.4,12,12,
2,17,30,Okaro White with an offensive rebound.,97445,,true,false,false,Okaro,,White,,FlaSt,,47,28,2,1,3,,,,,8,,,,5,Offensive Rebound,,,,12,12,
2,17,25,Okaro White makes a layup shot.,97445,,true,false,false,Okaro,,White,,FlaSt,,47,30,2,1,3,,,,,10,2,40,Layup Shot,3,Field Goal Made,0,0,0,12,12,
2,17,03,Shooting foul committed by Robert Gilchrist.,116528,,true,false,false,Robert,,Gilchrist,,FlaSt,,47,30,3,1,2,,,,,0,,2,Shooting,8,Foul,,,,12,12,
2,17,03,Joe Harris makes free throw 1 of 2.,97108,,true,false,false,Joe,,Harris,,UVa,,48,30,3,1,0,,,,,11,1,11,Free Throw 1 of 2,1,Free Throw Made,,,,17,17,
2,17,03,Joe Harris makes free throw 2 of 2.,97108,,true,false,false,Joe,,Harris,,UVa,,49,30,3,1,0,,,,,12,1,12,Free Throw 2 of 2,1,Free Throw Made,,,,17,17,
2,16,49,Ian Miller with a traveling turnover: Traveling,97446,,true,false,false,Ian,,Miller,,FlaSt,,49,30,3,1,1,,,,,3,,4,Traveling,7,Turnover,,,,12,12,
2,16,18,Akil Mitchell misses a layup shot.,97111,,true,false,false,Akil,,Mitchell,,UVa,,49,30,3,1,1,,,,,7,2,40,Layup Shot,4,Field Goal Missed,0,0,0,17,17,
2,16,18,Devon Bookert with a defensive rebound.,116526,,true,false,false,Devon,,Bookert,,FlaSt,,49,30,3,1,1,,,,,5,,,,6,Defensive Rebound,,,,12,12,
2,16,09,Ian Miller misses a 3-point jump shot from 25 feet out.,97446,,true,false,false,Ian,,Miller,,FlaSt,,49,30,3,1,1,,,,,3,3,45,Jump Shot,4,Field Goal Missed,25,-22.4,12,12,12,
