half,time-minutes,time-seconds,details,player1-id,player2-id,player1-linkable,player2-linkable,player3-linkable,player-first-name-1,player-first-name-2,player-last-name-1,player-last-name-2,player-team-alias-1,player-team-alias-2,home-score,visitor-score,visitor-fouls,home-fouls,player-fouls,fastbreak,in-paint,second-chance,off-turnover,player-score,points-type,detail-id,detail-desc,event-id,event-desc,distance,x-coord,y-coord,team-id-1,team-id-2,team-id-3
1,20,00,Start of the 1st Half,,,false,false,false,,,,,,,0,0,0,0,0,,,,,0,,,,14,Start Period,,,,46,46,
1,19,38,Rodney Hood misses a 3-point jump shot from 23 feet out.,109781,,true,false,false,Rodney,,Hood,,Duke,,0,0,0,0,0,,,,,0,3,45,Jump Shot,4,Field Goal Missed,23,17.8,14.4,11,11,
1,19,38,Garrick Sherman with a defensive rebound.,88941,,true,false,false,Garrick,,Sherman,,ND,,0,0,0,0,0,,,,,0,,,,6,Defensive Rebound,,,,46,46,
1,19,32,Garrick Sherman with a lost ball turnover: Lost Ball,88941,,true,false,false,Garrick,,Sherman,,ND,,0,0,0,0,0,,,,,0,,2,Lost Ball,7,Turnover,,,,46,46,
1,19,32,Quinn Cook makes a layup shot.,109412,,true,false,false,Quinn,,Cook,,Duke,,0,2,0,0,0,,,,,2,2,40,Layup Shot,3,Field Goal Made,0,0,0,11,11,
1,19,05,Eric Atkins misses a 3-point jump shot from 24 feet out.,97478,,true,false,false,Eric,,Atkins,,ND,,0,2,0,0,0,,,,,0,3,45,Jump Shot,4,Field Goal Missed,24,10.1,21.3,46,46,
1,19,05,Quinn Cook with a defensive rebound.,109412,,true,false,false,Quinn,,Cook,,Duke,,0,2,0,0,0,,,,,2,,,,6,Defensive Rebound,,,,11,11,
1,18,50,Jabari Parker misses a 3-point jump shot from 25 feet out.,121033,,true,false,false,Jabari,,Parker,,Duke,,0,2,0,0,0,,,,,0,3,45,Jump Shot,4,Field Goal Missed,25,-6,24.6,11,11,
1,18,50,Garrick Sherman with a defensive rebound.,88941,,true,false,false,Garrick,,Sherman,,ND,,0,2,0,0,0,,,,,0,,,,6,Defensive Rebound,,,,46,46,
1,18,24,Zach Auguste makes a jump shot from 8 feet out.,116591,,true,false,false,Zach,,Auguste,,ND,,2,2,0,0,0,,,,,2,2,45,Jump Shot,3,Field Goal Made,8,.6,7.9,46,46,
1,17,59,Tyler Thornton makes a 3-point jump shot from 24 feet out. Rodney Hood with the assist.,97330,109781,true,true,false,Tyler,Rodney,Thornton,Hood,Duke,Duke,2,5,0,0,0,,,,,3,3,45,Jump Shot,3,Field Goal Made,24,13.2,20.3,11,11,
1,17,34,Personal foul committed by Josh Hairston.,97328,,true,false,false,Josh,,Hairston,,Duke,,2,5,1,0,1,,,,,0,,1,Personal,8,Foul,,,,11,11,
1,17,27,Garrick Sherman makes a layup shot. Eric Atkins with the assist.,88941,97478,true,true,false,Garrick,Eric,Sherman,Atkins,ND,ND,4,5,1,0,0,,,,,2,2,40,Layup Shot,3,Field Goal Made,0,0,0,46,46,
1,17,12,Shooting foul committed by Garrick Sherman.,88941,,true,false,false,Garrick,,Sherman,,ND,,4,5,1,1,1,,,,,2,,2,Shooting,8,Foul,,,,46,46,
1,17,12,Jabari Parker misses free throw 1 of 2.,121033,,true,false,false,Jabari,,Parker,,Duke,,4,5,1,1,0,,,,,0,1,11,Free Throw 1 of 2,2,Free Throw Missed,,,,11,11,
1,17,12,Duke with an offensive rebound.,,,false,false,false,,,,,,,4,5,1,1,0,,,,,0,,,,5,Offensive Rebound,,,,11,11,
1,17,12,Jabari Parker misses free throw 2 of 2.,121033,,true,false,false,Jabari,,Parker,,Duke,,4,5,1,1,0,,,,,0,1,12,Free Throw 2 of 2,2,Free Throw Missed,,,,11,11,
1,17,12,Garrick Sherman with a defensive rebound.,88941,,true,false,false,Garrick,,Sherman,,ND,,4,5,1,1,1,,,,,2,,,,6,Defensive Rebound,,,,46,46,
1,17,00,Eric Atkins makes a layup shot.,97478,,true,false,false,Eric,,Atkins,,ND,,6,5,1,1,0,,,,,2,2,40,Layup Shot,3,Field Goal Made,0,0,0,46,46,
1,16,45,Quinn Cook makes a 3-point jump shot from 25 feet out. Rodney Hood with the assist.,109412,109781,true,true,false,Quinn,Rodney,Cook,Hood,Duke,Duke,6,8,1,1,0,,,,,5,3,45,Jump Shot,3,Field Goal Made,25,15.7,19,11,11,
1,16,23,Zach Auguste makes a layup shot.,116591,,true,false,false,Zach,,Auguste,,ND,,8,8,1,1,0,,,,,4,2,40,Layup Shot,3,Field Goal Made,0,0,0,46,46,
1,16,15,Rodney Hood makes a 3-point jump shot from 25 feet out.,109781,,true,false,false,Rodney,,Hood,,Duke,,8,11,1,1,0,,,,,3,3,45,Jump Shot,3,Field Goal Made,25,-13.5,20.7,11,11,
1,15,57,Eric Atkins misses a 3-point jump shot from 25 feet out.,97478,,true,false,false,Eric,,Atkins,,ND,,8,11,1,1,0,,,,,2,3,45,Jump Shot,4,Field Goal Missed,25,11.1,21.8,46,46,
1,15,57,Quinn Cook with a defensive rebound.,109412,,true,false,false,Quinn,,Cook,,Duke,,8,11,1,1,0,,,,,5,,,,6,Defensive Rebound,,,,11,11,
1,15,42,Jabari Parker misses a 3-point jump shot from 25 feet out.,121033,,true,false,false,Jabari,,Parker,,Duke,,8,11,1,1,0,,,,,0,3,45,Jump Shot,4,Field Goal Missed,25,-15,20,11,11,
1,15,42,Duke with an offensive rebound.,,,false,false,false,,,,,,,8,11,1,1,0,,,,,0,,,,5,Offensive Rebound,,,,11,11,
1,15,41,Official TV timeout.,,,false,false,false,,,,,,,8,11,1,1,0,,,,,0,,3,Official TV,11,Timeout,,,,46,46,
1,15,37,Andre Dawkins misses a 3-point jump shot from 24 feet out.,88970,,true,false,false,Andre,,Dawkins,,Duke,,8,11,1,1,0,,,,,0,3,45,Jump Shot,4,Field Goal Missed,24,20.8,11.1,11,11,
1,15,37,Demetrius Jackson with a defensive rebound.,120755,,true,false,false,Demetrius,,Jackson,,ND,,8,11,1,1,0,,,,,0,,,,6,Defensive Rebound,,,,46,46,
1,15,12,Zach Auguste misses a layup shot.,116591,,true,false,false,Zach,,Auguste,,ND,,8,11,1,1,0,,,,,4,2,40,Layup Shot,4,Field Goal Missed,0,0,0,46,46,
1,15,12,Amile Jefferson with a defensive rebound.,116520,,true,false,false,Amile,,Jefferson,,Duke,,8,11,1,1,0,,,,,0,,,,6,Defensive Rebound,,,,11,11,
1,14,52,Quinn Cook misses a layup shot.,109412,,true,false,false,Quinn,,Cook,,Duke,,8,11,1,1,0,,,,,5,2,40,Layup Shot,4,Field Goal Missed,0,0,0,11,11,
1,14,52,Duke with an offensive rebound.,,,false,false,false,,,,,,,8,11,1,1,0,,,,,0,,,,5,Offensive Rebound,,,,11,11,
1,14,49,Rodney Hood makes a jump shot from 9 feet out.,109781,,true,false,false,Rodney,,Hood,,Duke,,8,13,1,1,0,,,,,5,2,45,Jump Shot,3,Field Goal Made,9,.9,8.6,11,11,
1,14,25,Pat Connaughton makes a layup shot. Garrick Sherman with the assist.,109491,88941,true,true,false,Pat,Garrick,Connaughton,Sherman,ND,ND,10,13,1,1,0,,,,,2,2,40,Layup Shot,3,Field Goal Made,0,0,0,46,46,
1,14,13,Rodney Hood with a traveling turnover: Traveling,109781,,true,false,false,Rodney,,Hood,,Duke,,10,13,1,1,0,,,,,5,,4,Traveling,7,Turnover,,,,11,11,
1,14,05,Eric Atkins with a bad pass turnover: Bad Pass,97478,,true,false,false,Eric,,Atkins,,ND,,10,13,1,1,0,,,,,2,,1,Bad Pass,7,Turnover,,,,46,46,
1,13,54,Quinn Cook misses a jump shot from 15 feet out.,109412,,true,false,false,Quinn,,Cook,,Duke,,10,13,1,1,0,,,,,5,2,45,Jump Shot,4,Field Goal Missed,15,14.7,2.5,11,11,
1,13,54,Garrick Sherman with a defensive rebound.,88941,,true,false,false,Garrick,,Sherman,,ND,,10,13,1,1,1,,,,,2,,,,6,Defensive Rebound,,,,46,46,
1,13,46,Eric Atkins makes a layup shot.,97478,,true,false,false,Eric,,Atkins,,ND,,12,13,1,1,0,,,,,4,2,40,Layup Shot,3,Field Goal Made,0,0,0,46,46,
1,13,27,Andre Dawkins makes a jump shot from 17 feet out.,88970,,true,false,false,Andre,,Dawkins,,Duke,,12,15,1,1,0,,,,,2,2,45,Jump Shot,3,Field Goal Made,17,11.3,12.2,11,11,
1,13,27,Shooting foul committed by V.J. Beachem.,120754,,true,false,false,V.J.,,Beachem,,ND,,12,15,1,2,1,,,,,0,,2,Shooting,8,Foul,,,,46,46,
1,13,27,Andre Dawkins makes free throw 1 of 1.,88970,,true,false,false,Andre,,Dawkins,,Duke,,12,16,1,2,0,,,,,3,1,10,Free Throw 1 of 1,1,Free Throw Made,,,,11,11,
1,12,57,Shooting foul committed by Andre Dawkins.,88970,,true,false,false,Andre,,Dawkins,,Duke,,12,16,2,2,1,,,,,3,,2,Shooting,8,Foul,,,,11,11,
1,12,57,Tom Knight misses free throw 1 of 2.,88670,,true,false,false,Tom,,Knight,,ND,,12,16,2,2,0,,,,,0,1,11,Free Throw 1 of 2,2,Free Throw Missed,,,,46,46,
1,12,57,ND with an offensive rebound.,,,false,false,false,,,,,,,12,16,2,2,0,,,,,0,,,,5,Offensive Rebound,,,,46,46,
1,12,57,Tom Knight misses free throw 2 of 2.,88670,,true,false,false,Tom,,Knight,,ND,,12,16,2,2,0,,,,,0,1,12,Free Throw 2 of 2,2,Free Throw Missed,,,,46,46,
1,12,57,Jabari Parker with a defensive rebound.,121033,,true,false,false,Jabari,,Parker,,Duke,,12,16,2,2,0,,,,,0,,,,6,Defensive Rebound,,,,11,11,
1,12,44,Rasheed Sulaimon misses a layup shot.,116519,,true,false,false,Rasheed,,Sulaimon,,Duke,,12,16,2,2,0,,,,,0,2,40,Layup Shot,4,Field Goal Missed,0,0,0,11,11,
1,12,44,Tom Knight with a defensive rebound.,88670,,true,false,false,Tom,,Knight,,ND,,12,16,2,2,0,,,,,0,,,,6,Defensive Rebound,,,,46,46,
1,12,22,V.J. Beachem misses a 3-point jump shot from 23 feet out.,120754,,true,false,false,V.J.,,Beachem,,ND,,12,16,2,2,1,,,,,0,3,45,Jump Shot,4,Field Goal Missed,23,-20.5,11.5,46,46,
1,12,22,ND with an offensive rebound.,,,false,false,false,,,,,,,12,16,2,2,0,,,,,0,,,,5,Offensive Rebound,,,,46,46,
1,12,18,Steve Vasturia makes a 3-point jump shot from 23 feet out. Eric Atkins with the assist.,120756,97478,true,true,false,Steve,Eric,Vasturia,Atkins,ND,ND,15,16,2,2,0,,,,,3,3,45,Jump Shot,3,Field Goal Made,23,-20.5,10.8,46,46,
1,11,59,Rodney Hood misses a layup shot.,109781,,true,false,false,Rodney,,Hood,,Duke,,15,16,2,2,0,,,,,5,2,40,Layup Shot,4,Field Goal Missed,0,0,0,11,11,
1,11,59,Amile Jefferson with an offensive rebound.,116520,,true,false,false,Amile,,Jefferson,,Duke,,15,16,2,2,0,,,,,0,,,,5,Offensive Rebound,,,,11,11,
1,11,59,Amile Jefferson misses a tip shot from 4 feet out.,116520,,true,false,false,Amile,,Jefferson,,Duke,,15,16,2,2,0,,,,,0,2,53,Tip Shot,4,Field Goal Missed,4,0,4,11,11,
1,11,59,Steve Vasturia with a defensive rebound.,120756,,true,false,false,Steve,,Vasturia,,ND,,15,16,2,2,0,,,,,3,,,,6,Defensive Rebound,,,,46,46,
1,11,53,Personal foul committed by Quinn Cook.,109412,,true,false,false,Quinn,,Cook,,Duke,,15,16,3,2,1,,,,,5,,1,Personal,8,Foul,,,,11,11,
1,11,53,Official TV timeout.,,,false,false,false,,,,,,,15,16,3,2,0,,,,,0,,3,Official TV,11,Timeout,,,,46,46,
1,11,17,V.J. Beachem makes a layup shot.,120754,,true,false,false,V.J.,,Beachem,,ND,,17,16,3,2,1,,,,,2,2,40,Layup Shot,3,Field Goal Made,0,0,0,46,46,
1,11,03,Personal foul committed by Tom Knight.,88670,,true,false,false,Tom,,Knight,,ND,,17,16,3,3,1,,,,,0,,1,Personal,8,Foul,,,,46,46,
1,10,58,Rodney Hood misses a jump shot from 15 feet out.,109781,,true,false,false,Rodney,,Hood,,Duke,,17,16,3,3,0,,,,,5,2,45,Jump Shot,4,Field Goal Missed,15,-13.5,5.5,11,11,
1,10,58,Austin Burgett with a defensive rebound.,116593,,true,false,false,Austin,,Burgett,,ND,,17,16,3,3,0,,,,,0,,,,6,Defensive Rebound,,,,46,46,
1,10,44,Garrick Sherman misses a jump shot from 10 feet out.,88941,,true,false,false,Garrick,,Sherman,,ND,,17,16,3,3,1,,,,,2,2,45,Jump Shot,4,Field Goal Missed,10,-8.1,5.3,46,46,
1,10,44,Amile Jefferson with a defensive rebound.,116520,,true,false,false,Amile,,Jefferson,,Duke,,17,16,3,3,0,,,,,0,,,,6,Defensive Rebound,,,,11,11,
1,10,24,Jabari Parker misses a layup shot.,121033,,true,false,false,Jabari,,Parker,,Duke,,17,16,3,3,0,,,,,0,2,40,Layup Shot,4,Field Goal Missed,0,0,0,11,11,
1,10,24,Austin Burgett with a defensive rebound.,116593,,true,false,false,Austin,,Burgett,,ND,,17,16,3,3,0,,,,,0,,,,6,Defensive Rebound,,,,46,46,
1,10,07,Garrick Sherman makes a hook shot from 7 feet out.,88941,,true,false,false,Garrick,,Sherman,,ND,,19,16,3,3,1,,,,,4,2,55,Hook Shot,3,Field Goal Made,7,-.1,6.5,46,46,
1,9,48,Rasheed Sulaimon makes a 3-point jump shot from 25 feet out.,116519,,true,false,false,Rasheed,,Sulaimon,,Duke,,19,19,3,3,0,,,,,3,3,45,Jump Shot,3,Field Goal Made,25,4,25.1,11,11,
1,9,31,Pat Connaughton makes a 3-point jump shot from 22 feet out. Eric Atkins with the assist.,109491,97478,true,true,false,Pat,Eric,Connaughton,Atkins,ND,ND,22,19,3,3,0,,,,,5,3,45,Jump Shot,3,Field Goal Made,22,22,4.5,46,46,
1,9,02,Rodney Hood misses a layup shot.,109781,,true,false,false,Rodney,,Hood,,Duke,,22,19,3,3,0,,,,,5,2,40,Layup Shot,4,Field Goal Missed,0,0,0,11,11,
1,9,02,Steve Vasturia with a defensive rebound.,120756,,true,false,false,Steve,,Vasturia,,ND,,22,19,3,3,0,,,,,3,,,,6,Defensive Rebound,,,,46,46,
1,8,43,Garrick Sherman misses a jump shot from 8 feet out.,88941,,true,false,false,Garrick,,Sherman,,ND,,22,19,3,3,1,,,,,4,2,45,Jump Shot,4,Field Goal Missed,8,.1,7.7,46,46,
1,8,43,Zach Auguste with an offensive rebound.,116591,,true,false,false,Zach,,Auguste,,ND,,22,19,3,3,0,,,,,4,,,,5,Offensive Rebound,,,,46,46,
1,8,37,Zach Auguste misses a layup shot.,116591,,true,false,false,Zach,,Auguste,,ND,,22,19,3,3,0,,,,,4,2,40,Layup Shot,4,Field Goal Missed,0,0,0,46,46,
1,8,37,Quinn Cook with a defensive rebound.,109412,,true,false,false,Quinn,,Cook,,Duke,,22,19,3,3,1,,,,,5,,,,6,Defensive Rebound,,,,11,11,
1,8,28,Josh Hairston makes a jump shot from 17 feet out. Quinn Cook with the assist.,97328,109412,true,true,false,Josh,Quinn,Hairston,Cook,Duke,Duke,22,21,3,3,1,,,,,2,2,45,Jump Shot,3,Field Goal Made,17,-7.9,15.4,11,11,
1,8,15,Personal foul committed by Rasheed Sulaimon.,116519,,true,false,false,Rasheed,,Sulaimon,,Duke,,22,21,4,3,1,,,,,3,,1,Personal,8,Foul,,,,11,11,
1,8,13,Garrick Sherman makes a layup shot. Eric Atkins with the assist.,88941,97478,true,true,false,Garrick,Eric,Sherman,Atkins,ND,ND,24,21,4,3,1,,,,,6,2,40,Layup Shot,3,Field Goal Made,0,0,0,46,46,
1,7,49,Rodney Hood makes a hook shot from 6 feet out.,109781,,true,false,false,Rodney,,Hood,,Duke,,24,23,4,3,0,,,,,7,2,55,Hook Shot,3,Field Goal Made,6,3.1,5.7,11,11,
1,7,24,Eric Atkins misses a jump shot from 11 feet out.,97478,,true,false,false,Eric,,Atkins,,ND,,24,23,4,3,0,,,,,4,2,45,Jump Shot,4,Field Goal Missed,11,9.9,3.8,46,46,
1,7,24,Zach Auguste with an offensive rebound.,116591,,true,false,false,Zach,,Auguste,,ND,,24,23,4,3,0,,,,,4,,,,5,Offensive Rebound,,,,46,46,
1,7,23,Official TV timeout.,,,false,false,false,,,,,,,24,23,4,3,0,,,,,0,,3,Official TV,11,Timeout,,,,46,46,
1,7,11,Garrick Sherman misses a hook shot from 7 feet out.,88941,,true,false,false,Garrick,,Sherman,,ND,,24,23,4,3,1,,,,,6,2,55,Hook Shot,4,Field Goal Missed,7,5.7,3.3,46,46,
1,7,11,Jabari Parker with a defensive rebound.,121033,,true,false,false,Jabari,,Parker,,Duke,,24,23,4,3,0,,,,,0,,,,6,Defensive Rebound,,,,11,11,
1,6,52,Jabari Parker misses a jump shot from 13 feet out.,121033,,true,false,false,Jabari,,Parker,,Duke,,24,23,4,3,0,,,,,0,2,45,Jump Shot,4,Field Goal Missed,13,12.7,3.6,11,11,
1,6,52,ND with a defensive rebound.,,,false,false,false,,,,,,,24,23,4,3,0,,,,,0,,,,6,Defensive Rebound,,,,46,46,
1,6,29,Garrick Sherman makes a layup shot. Pat Connaughton with the assist.,88941,109491,true,true,false,Garrick,Pat,Sherman,Connaughton,ND,ND,26,23,4,3,1,,,,,8,2,40,Layup Shot,3,Field Goal Made,0,0,0,46,46,
1,6,11,Jabari Parker makes a 3-point jump shot from 24 feet out. Quinn Cook with the assist.,121033,109412,true,true,false,Jabari,Quinn,Parker,Cook,Duke,Duke,26,26,4,3,0,,,,,3,3,45,Jump Shot,3,Field Goal Made,24,17.3,16.4,11,11,
1,5,50,Pat Connaughton misses a jump shot from 12 feet out.,109491,,true,false,false,Pat,,Connaughton,,ND,,26,26,4,3,0,,,,,5,2,45,Jump Shot,4,Field Goal Missed,12,12,3.3,46,46,
1,5,50,Zach Auguste with an offensive rebound.,116591,,true,false,false,Zach,,Auguste,,ND,,26,26,4,3,0,,,,,4,,,,5,Offensive Rebound,,,,46,46,
1,5,50,Zach Auguste misses a tip shot from 3 feet out.,116591,,true,false,false,Zach,,Auguste,,ND,,26,26,4,3,0,,,,,4,2,53,Tip Shot,4,Field Goal Missed,3,1.1,3.1,46,46,
1,5,50,Duke with a defensive rebound.,,,false,false,false,,,,,,,26,26,4,3,0,,,,,0,,,,6,Defensive Rebound,,,,11,11,
1,5,32,Jabari Parker misses a 3-point jump shot from 26 feet out.,121033,,true,false,false,Jabari,,Parker,,Duke,,26,26,4,3,0,,,,,3,3,45,Jump Shot,4,Field Goal Missed,26,-6.4,24.7,11,11,
1,5,32,Steve Vasturia with a defensive rebound.,120756,,true,false,false,Steve,,Vasturia,,ND,,26,26,4,3,0,,,,,3,,,,6,Defensive Rebound,,,,46,46,
1,5,25,Steve Vasturia with a lost ball turnover: Lost Ball,120756,,true,false,false,Steve,,Vasturia,,ND,,26,26,4,3,0,,,,,3,,2,Lost Ball,7,Turnover,,,,46,46,
1,5,18,Personal foul committed by Austin Burgett.,116593,,true,false,false,Austin,,Burgett,,ND,,26,26,4,4,1,,,,,0,,1,Personal,8,Foul,,,,46,46,
1,5,14,Andre Dawkins misses a 3-point jump shot from 23 feet out.,88970,,true,false,false,Andre,,Dawkins,,Duke,,26,26,4,4,1,,,,,3,3,45,Jump Shot,4,Field Goal Missed,23,22.2,5.2,11,11,
1,5,14,Austin Burgett with a defensive rebound.,116593,,true,false,false,Austin,,Burgett,,ND,,26,26,4,4,1,,,,,0,,,,6,Defensive Rebound,,,,46,46,
1,5,05,V.J. Beachem misses a jump shot from 12 feet out.,120754,,true,false,false,V.J.,,Beachem,,ND,,26,26,4,4,1,,,,,2,2,45,Jump Shot,4,Field Goal Missed,12,-1.1,11.6,46,46,
1,5,05,Austin Burgett with an offensive rebound.,116593,,true,false,false,Austin,,Burgett,,ND,,26,26,4,4,1,,,,,0,,,,5,Offensive Rebound,,,,46,46,
1,5,00,Tom Knight misses a tip shot from 4 feet out.,88670,,true,false,false,Tom,,Knight,,ND,,26,26,4,4,1,,,,,0,2,53,Tip Shot,4,Field Goal Missed,4,0,4,46,46,
1,5,00,Andre Dawkins with a defensive rebound.,88970,,true,false,false,Andre,,Dawkins,,Duke,,26,26,4,4,1,,,,,3,,,,6,Defensive Rebound,,,,11,11,
1,4,55,Andre Dawkins misses a 3-point jump shot from 25 feet out.,88970,,true,false,false,Andre,,Dawkins,,Duke,,26,26,4,4,1,,,,,3,3,45,Jump Shot,4,Field Goal Missed,25,14.9,20.3,11,11,
1,4,55,Austin Burgett with a defensive rebound.,116593,,true,false,false,Austin,,Burgett,,ND,,26,26,4,4,1,,,,,0,,,,6,Defensive Rebound,,,,46,46,
1,4,31,Personal foul committed by Andre Dawkins.,88970,,true,false,false,Andre,,Dawkins,,Duke,,26,26,5,4,2,,,,,3,,1,Personal,8,Foul,,,,11,11,
1,4,31,Tom Knight makes a dunk shot. Demetrius Jackson with the assist.,88670,120755,true,true,false,Tom,Demetrius,Knight,Jackson,ND,ND,28,26,5,4,1,,,,,2,2,48,Dunk Shot,3,Field Goal Made,0,0,0,46,46,
1,3,59,Quinn Cook makes a 3-point jump shot from 27 feet out.,109412,,true,false,false,Quinn,,Cook,,Duke,,28,29,5,4,1,,,,,8,3,45,Jump Shot,3,Field Goal Made,27,10.8,24.6,11,11,
1,3,53,Shooting foul committed by Tyler Thornton.,97330,,true,false,false,Tyler,,Thornton,,Duke,,28,29,6,4,1,,,,,3,,2,Shooting,8,Foul,,,,11,11,
1,3,53,Official TV timeout.,,,false,false,false,,,,,,,28,29,6,4,0,,,,,0,,3,Official TV,11,Timeout,,,,46,46,
1,3,53,Tom Knight makes free throw 1 of 2.,88670,,true,false,false,Tom,,Knight,,ND,,29,29,6,4,1,,,,,3,1,11,Free Throw 1 of 2,1,Free Throw Made,,,,46,46,
1,3,53,Tom Knight misses free throw 2 of 2.,88670,,true,false,false,Tom,,Knight,,ND,,29,29,6,4,1,,,,,3,1,12,Free Throw 2 of 2,2,Free Throw Missed,,,,46,46,
1,3,53,Rasheed Sulaimon with a defensive rebound.,116519,,true,false,false,Rasheed,,Sulaimon,,Duke,,29,29,6,4,1,,,,,3,,,,6,Defensive Rebound,,,,11,11,
1,3,36,Quinn Cook with a lost ball turnover: Lost Ball,109412,,true,false,false,Quinn,,Cook,,Duke,,29,29,6,4,1,,,,,8,,2,Lost Ball,7,Turnover,,,,11,11,
1,3,17,Personal foul committed by Rasheed Sulaimon.,116519,,true,false,false,Rasheed,,Sulaimon,,Duke,,29,29,7,4,2,,,,,3,,1,Personal,8,Foul,,,,11,11,
1,3,17,Eric Atkins makes free throw 1 of 2.,97478,,true,false,false,Eric,,Atkins,,ND,,30,29,7,4,0,,,,,5,1,11,Free Throw 1 of 2,1,Free Throw Made,,,,46,46,
1,3,17,Eric Atkins misses free throw 2 of 2.,97478,,true,false,false,Eric,,Atkins,,ND,,30,29,7,4,0,,,,,5,1,12,Free Throw 2 of 2,2,Free Throw Missed,,,,46,46,
1,3,17,Rodney Hood with a defensive rebound.,109781,,true,false,false,Rodney,,Hood,,Duke,,30,29,7,4,0,,,,,7,,,,6,Defensive Rebound,,,,11,11,
1,2,57,Jabari Parker misses a hook shot from 8 feet out.,121033,,true,false,false,Jabari,,Parker,,Duke,,30,29,7,4,0,,,,,3,2,55,Hook Shot,4,Field Goal Missed,8,0,8,11,11,
1,2,57,Demetrius Jackson with a defensive rebound.,120755,,true,false,false,Demetrius,,Jackson,,ND,,30,29,7,4,0,,,,,0,,,,6,Defensive Rebound,,,,46,46,
1,2,46,Eric Atkins misses a layup shot.,97478,,true,false,false,Eric,,Atkins,,ND,,30,29,7,4,0,,,,,5,2,40,Layup Shot,4,Field Goal Missed,0,0,0,46,46,
1,2,46,Garrick Sherman with an offensive rebound.,88941,,true,false,false,Garrick,,Sherman,,ND,,30,29,7,4,1,,,,,8,,,,5,Offensive Rebound,,,,46,46,
1,2,41,Garrick Sherman misses a tip shot from 4 feet out.,88941,,true,false,false,Garrick,,Sherman,,ND,,30,29,7,4,1,,,,,8,2,53,Tip Shot,4,Field Goal Missed,4,.1,3.8,46,46,
1,2,41,Garrick Sherman with an offensive rebound.,88941,,true,false,false,Garrick,,Sherman,,ND,,30,29,7,4,1,,,,,8,,,,5,Offensive Rebound,,,,46,46,
1,2,41,Garrick Sherman misses a layup shot.,88941,,true,false,false,Garrick,,Sherman,,ND,,30,29,7,4,1,,,,,8,2,40,Layup Shot,4,Field Goal Missed,0,0,0,46,46,
1,2,41,ND with an offensive rebound.,,,false,false,false,,,,,,,30,29,7,4,0,,,,,0,,,,5,Offensive Rebound,,,,46,46,
1,2,35,Garrick Sherman misses a hook shot from 7 feet out.,88941,,true,false,false,Garrick,,Sherman,,ND,,30,29,7,4,1,,,,,8,2,55,Hook Shot,4,Field Goal Missed,7,5,5,46,46,
1,2,35,Quinn Cook with a defensive rebound.,109412,,true,false,false,Quinn,,Cook,,Duke,,30,29,7,4,1,,,,,8,,,,6,Defensive Rebound,,,,11,11,
1,2,11,Tyler Thornton misses a 3-point jump shot from 25 feet out.,97330,,true,false,false,Tyler,,Thornton,,Duke,,30,29,7,4,1,,,,,3,3,45,Jump Shot,4,Field Goal Missed,25,-3.3,25.1,11,11,
1,2,11,Jabari Parker with an offensive rebound.,121033,,true,false,false,Jabari,,Parker,,Duke,,30,29,7,4,0,,,,,3,,,,5,Offensive Rebound,,,,11,11,
1,2,11,Personal foul committed by Garrick Sherman.,88941,,true,false,false,Garrick,,Sherman,,ND,,30,29,7,5,2,,,,,8,,1,Personal,8,Foul,,,,46,46,
1,2,09,Jabari Parker makes a jump shot from 15 feet out. Quinn Cook with the assist.,121033,109412,true,true,false,Jabari,Quinn,Parker,Cook,Duke,Duke,30,31,7,5,0,,,,,5,2,45,Jump Shot,3,Field Goal Made,15,-9.6,12,11,11,
1,1,48,Steve Vasturia makes a 3-point jump shot from 24 feet out. Pat Connaughton with the assist.,120756,109491,true,true,false,Steve,Pat,Vasturia,Connaughton,ND,ND,33,31,7,5,0,,,,,6,3,45,Jump Shot,3,Field Goal Made,24,-19.5,13.2,46,46,
1,1,25,Rasheed Sulaimon misses a jump shot from 10 feet out.,116519,,true,false,false,Rasheed,,Sulaimon,,Duke,,33,31,7,5,2,,,,,3,2,45,Jump Shot,4,Field Goal Missed,10,3,9,11,11,
1,1,25,Pat Connaughton with a defensive rebound.,109491,,true,false,false,Pat,,Connaughton,,ND,,33,31,7,5,0,,,,,5,,,,6,Defensive Rebound,,,,46,46,
1,1,21,Pat Connaughton makes a jump shot from 20 feet out.,109491,,true,false,false,Pat,,Connaughton,,ND,,35,31,7,5,0,,,,,7,2,45,Jump Shot,3,Field Goal Made,20,-1,20,46,46,
1,1,20,Duke take a 20-second timeout.,,,false,false,false,,,,,,,35,31,7,5,0,,,,,0,,2,Short,11,Timeout,,,,11,11,
1,0,58.9,Rodney Hood makes a 3-point jump shot from 25 feet out.,109781,,true,false,false,Rodney,,Hood,,Duke,,35,34,7,5,0,,,,,10,3,45,Jump Shot,3,Field Goal Made,25,-5.9,23.9,11,11,
1,0,33.7,Pat Connaughton misses a layup shot.,109491,,true,false,false,Pat,,Connaughton,,ND,,35,34,7,5,0,,,,,7,2,40,Layup Shot,4,Field Goal Missed,0,0,0,46,46,
1,0,33.7,Jabari Parker with a defensive rebound.,121033,,true,false,false,Jabari,,Parker,,Duke,,35,34,7,5,0,,,,,5,,,,6,Defensive Rebound,,,,11,11,
1,0,01.7,Rodney Hood makes a 3-point jump shot from 23 feet out.,109781,,true,false,false,Rodney,,Hood,,Duke,,35,37,7,5,0,,,,,13,3,45,Jump Shot,3,Field Goal Made,23,7.2,22.4,11,11,
1,0,00,End of the 1st Half,,,false,false,false,,,,,,,35,37,7,5,0,,,,,0,,,,15,End Period,,,,46,46,
2,20,00,Start of the 2nd Half,,,false,false,false,,,,,,,35,37,0,0,0,,,,,0,,,,14,Start Period,,,,46,46,
2,19,41,Personal foul committed by Josh Hairston.,97328,,true,false,false,Josh,,Hairston,,Duke,,35,37,1,0,2,,,,,2,,1,Personal,8,Foul,,,,11,11,
2,19,28,Garrick Sherman misses a hook shot from 8 feet out.,88941,,true,false,false,Garrick,,Sherman,,ND,,35,37,1,0,2,,,,,8,2,55,Hook Shot,4,Field Goal Missed,8,-6.5,5,46,46,
2,19,28,Tyler Thornton with a defensive rebound.,97330,,true,false,false,Tyler,,Thornton,,Duke,,35,37,1,0,1,,,,,3,,,,6,Defensive Rebound,,,,11,11,
2,19,15,Jabari Parker with a lost ball turnover: Lost Ball,121033,,true,false,false,Jabari,,Parker,,Duke,,35,37,1,0,0,,,,,5,,2,Lost Ball,7,Turnover,,,,11,11,
2,18,55,Zach Auguste makes a jump shot from 8 feet out. Eric Atkins with the assist.,116591,97478,true,true,false,Zach,Eric,Auguste,Atkins,ND,ND,37,37,1,0,0,,,,,6,2,45,Jump Shot,3,Field Goal Made,8,5.9,4.7,46,46,
2,18,27,Rodney Hood makes a 3-point jump shot from 23 feet out.,109781,,true,false,false,Rodney,,Hood,,Duke,,37,40,1,0,0,,,,,16,3,45,Jump Shot,3,Field Goal Made,23,-19.3,13.3,11,11,
2,18,20,Shooting foul committed by Josh Hairston.,97328,,true,false,false,Josh,,Hairston,,Duke,,37,40,2,0,3,,,,,2,,2,Shooting,8,Foul,,,,11,11,
2,18,20,Garrick Sherman makes free throw 1 of 2.,88941,,true,false,false,Garrick,,Sherman,,ND,,38,40,2,0,2,,,,,9,1,11,Free Throw 1 of 2,1,Free Throw Made,,,,46,46,
2,18,20,Garrick Sherman misses free throw 2 of 2.,88941,,true,false,false,Garrick,,Sherman,,ND,,38,40,2,0,2,,,,,9,1,12,Free Throw 2 of 2,2,Free Throw Missed,,,,46,46,
2,18,20,Pat Connaughton with an offensive rebound.,109491,,true,false,false,Pat,,Connaughton,,ND,,38,40,2,0,0,,,,,7,,,,5,Offensive Rebound,,,,46,46,
2,18,15,Demetrius Jackson makes a layup shot. Eric Atkins with the assist.,120755,97478,true,true,false,Demetrius,Eric,Jackson,Atkins,ND,ND,40,40,2,0,0,,,,,2,2,40,Layup Shot,3,Field Goal Made,0,0,0,46,46,
2,17,54,Shooting foul committed by Pat Connaughton.,109491,,true,false,false,Pat,,Connaughton,,ND,,40,40,2,1,1,,,,,7,,2,Shooting,8,Foul,,,,46,46,
2,17,54,Rodney Hood makes free throw 1 of 2.,109781,,true,false,false,Rodney,,Hood,,Duke,,40,41,2,1,0,,,,,17,1,11,Free Throw 1 of 2,1,Free Throw Made,,,,11,11,
2,17,54,Rodney Hood makes free throw 2 of 2.,109781,,true,false,false,Rodney,,Hood,,Duke,,40,42,2,1,0,,,,,18,1,12,Free Throw 2 of 2,1,Free Throw Made,,,,11,11,
2,17,41,Demetrius Jackson misses a jump shot from 18 feet out.,120755,,true,false,false,Demetrius,,Jackson,,ND,,40,42,2,1,0,,,,,2,2,45,Jump Shot,4,Field Goal Missed,18,9.9,15,46,46,
2,17,41,Garrick Sherman with an offensive rebound.,88941,,true,false,false,Garrick,,Sherman,,ND,,40,42,2,1,2,,,,,9,,,,5,Offensive Rebound,,,,46,46,
2,17,37,Garrick Sherman misses a jump shot from 11 feet out.,88941,,true,false,false,Garrick,,Sherman,,ND,,40,42,2,1,2,,,,,9,2,45,Jump Shot,4,Field Goal Missed,11,5.7,9.3,46,46,
2,17,37,Duke with a defensive rebound.,,,false,false,false,,,,,,,40,42,2,1,0,,,,,0,,,,6,Defensive Rebound,,,,11,11,
